,Date,tweet
288,2022-06-28 04:43:39+00:00,"Electrifying everything does not solve the climate crisis, but it is a great start https://t.co/McUChfaGTA"
289,2022-06-28 04:24:11+00:00,The lion’s share of the world's grain production goes to animals https://t.co/bqBQmF9giC
290,2022-06-28 04:04:27+00:00,Any respite from China’s crackdown on the consumer internet may be short-lived and selective https://t.co/inzS3mhMtb
291,2022-06-28 03:46:05+00:00,"If the blockage is a result of dried mucus, it can be corrected by a procedure called Fallopian-tube recanalisation. This is not a new approach, but it may be an underused one https://t.co/rnWFLssJyD"
292,2022-06-28 03:25:19+00:00,“Atoms and Ashes” is a dramatic account of nuclear accidents https://t.co/xZPgcvhBaS
293,2022-06-28 03:04:08+00:00,Latin America lacks decent sex education in its schools https://t.co/60v5ghswjX
294,2022-06-28 02:42:52+00:00,"With a pro-Orban prime minister gone, things are looking up in Slovenia https://t.co/p0x7QHpCjJ"
295,2022-06-28 02:21:57+00:00,Costly food and energy are fostering global unrest https://t.co/EKyctb6eZY
296,2022-06-28 02:00:37+00:00,It is hard to export in a war—and there is nowhere to put it https://t.co/TfK7bvuWlg
297,2022-06-28 01:40:08+00:00,"After Roe, the war over reproductive rights in America will heat up rather than cool down https://t.co/rVu0QxhnMx"
298,2022-06-28 01:18:33+00:00,The movement helped enshrine a modern Vietnamese identity in cities—and paved the way for green-minded architects today https://t.co/GvfGWtJAIK
299,2022-06-28 00:57:15+00:00,We explain how two recent rulings could change America’s relationship with religion https://t.co/u89QlgbaEK
300,2022-06-28 00:36:56+00:00,"Falling goods prices could help douse the inflationary flames in the rich world. But, with enough indicators of future prices pointing the other way, the odds of that happening have lengthened https://t.co/kZnUFnwM0a"
301,2022-06-28 00:16:27+00:00,"This year’s energy shock is the most serious since the Middle Eastern oil crises of 1973 and 1979. Like those calamities, it promises to inflict short-term pain and in the longer term to transform the energy industry https://t.co/YffcDzJSEw"
302,2022-06-27 23:56:13+00:00,Markets are suffering more negative surprises than positive ones https://t.co/hDjDTz0h1R
303,2022-06-27 23:14:38+00:00,Ukraine is stepping up its attacks on the strategically important rock https://t.co/kMUTvQyncE
304,2022-06-27 22:52:49+00:00,The state is reshaping one of the world’s biggest startup scenes—not necessarily for the better https://t.co/C0c0mZv6EO
305,2022-06-27 22:31:56+00:00,Joe Biden’s administration should take urgent steps to safeguard the reproductive rights of American women https://t.co/tmyBinypXJ
306,2022-06-27 22:11:45+00:00,"When it comes to religious freedom, in contrast with abortion, the Supreme Court’s conservative majority is not owning up to the transformation it is effecting https://t.co/xAw5McdzUm"
307,2022-06-27 22:06:50+00:00,"“They certainly seem to be circling in on the possibility of actors who were involved in the so-called seditious conspiracy.” 

On “Checks and Balance”, @Edanyaperry examines the possible criminal charges being laid out by the January 6th committee https://t.co/ygSIcfO3yc"
308,2022-06-27 22:04:02+00:00,I wonder if Elon plays football/soccer. 🤭
309,2022-06-27 21:55:45+00:00,"Always knew you are a strong supporter, but didn't know this story. Good to know. Cheers! https://t.co/xfyCo5B0jf"
310,2022-06-27 21:49:06+00:00,"The disagreement over the question of investing in gas hints at a deeper problem 
https://t.co/K9IhAt0AB9"
311,2022-06-27 21:31:04+00:00,"Regardless of whether nuclear power experiences a comeback, just solving the problem of that 260,000 tonnes of existing waste will surely require lots of digging https://t.co/XLROxVJ2Vj"
312,2022-06-27 21:18:46+00:00,From 2010 to 2019 the amount of grain used for animal feed rose from 770m tonnes per year to 987m https://t.co/aGndXK8h7K
313,2022-06-27 21:00:56+00:00,"Some NATO members—Britain, Poland and other eastern European countries—are keen to underscore Russia’s pariah status, whereas France has reiterated that Europe would eventually have to engage with Russia again https://t.co/EiK5SRJV4r"
314,2022-06-27 20:43:13+00:00,The war in Ukraine is weighing on liveability https://t.co/WqhDFJF56B
315,2022-06-27 20:21:01+00:00,"Tricky economics is not the only problem America’s uranium industry faces. In many western communities uranium mining is unpopular at best, and considered criminal at worst https://t.co/3u4u3mAa2Q"
316,2022-06-27 19:58:47+00:00,"In America’s most doctrinaire pro-life states, the abortion regime will be more austere than that of Pakistan or Saudi Arabia, which permit the procedure to preserve the health, not just the life, of the mother https://t.co/bCdgVKJvUE"
317,2022-06-27 19:41:17+00:00,"A funding crunch could inflict real damage. Worse still, business models are exposed to a souring economic environment https://t.co/rWWjkUirnG"
318,2022-06-27 19:19:52+00:00,"If building a nuclear power plant goes badly, investors charge a lot for the money they provide, demand for new plants goes down and no one learns to do the building better https://t.co/0w27WW1fjS"
319,2022-06-27 18:57:50+00:00,"The last time EY split off its consultancy in 2000, the partners who received cash, not shares, did better https://t.co/sTBjnsG0mV"
320,2022-06-27 18:40:13+00:00,Evidence is mounting that workers are starting to bargain for higher wages. This could create another round of price increases as firms pass on these extra costs https://t.co/BsokIfgWJi
321,2022-06-27 18:19:20+00:00,Architects in Vietnam incorporated their country’s traditional design into the modernist gospel. Today the style is being revitalised https://t.co/argezVbKNf
322,2022-06-27 18:03:42+00:00,"Researchers think they have shown, admittedly in a fairly small sample of individuals, that friends actually smell alike 
https://t.co/jr3UN2dG98"
323,2022-06-27 17:48:08+00:00,"Supporters can find their hopes raised, dashed and then raised again over the course of the contest. Joy and despair are all the more intense for being slow to arrive https://t.co/ULIMw1lOyD"
324,2022-06-27 17:32:26+00:00,Six times the grain output of Ukraine and Russia combined is either burned as biofuel or used to feed animals https://t.co/GW9wvRB4qy
325,2022-06-27 17:14:03+00:00,"They are the product of an industry that contractually regulates the minutiae of its stars’ lives. Maybe breaking up will, in time, let its individual stars break character https://t.co/20vtUAnEAx"
326,2022-06-27 17:02:05+00:00,"Property owners cannot buy insurance for erosion. But there is a moral case for offering help, especially to buyers who purchased their properties in places where the policy subsequently shifted to letting sea defences fail https://t.co/bEHSQ7ndAp"
327,2022-06-27 17:00:04+00:00,"Cut through the jargon with thoughtful, clear insight and analysis on world events https://t.co/cO8obQg7MS https://t.co/FvDD5UpEIT"
328,2022-06-27 16:58:02+00:00,"In January if you had a $100,000 deposit and wanted to pay $3,000 per month you could buy a house in America valued at $850,000. Now the equivalent value would be $600,000. On this week’s “Money Talks”: what rising rates mean for property https://t.co/Pje6tVorX5"
329,2022-06-27 16:54:03+00:00,"Rather than depicting a historical event, Thomas J. Price’s figures in Hackney fold the past into the multi-racial present https://t.co/xdxz4BKPbP"
330,2022-06-27 16:52:06+00:00,"“I would think it would be wrong for the Fed to stop here.”

@paulkrugman talks to @AnneMcElvoy and @Henry_Curr about how to fight inflation, on “The Economist Asks” podcast https://t.co/psRslKS1Fm"
331,2022-06-27 16:35:48+00:00,Economists are worried about a so-called “doom loop” between different parts of the economy. We explain why https://t.co/PtPdGqZfE2
332,2022-06-27 16:19:39+00:00,Feeling bereft of football action this summer? Try kicking off the season with these books about the beautiful game https://t.co/dDVTSBiEv8
333,2022-06-27 16:11:52+00:00,"@BTC_Archive Fiat money should be stable, no?"
334,2022-06-27 16:04:05+00:00,About 47m people are at risk of hunger because of Russia's war in Ukraine. Could more grain be used to feed humans instead of animals? https://t.co/icQkKwuXWu
335,2022-06-27 16:03:55+00:00,"All updates posted in the vip channel. Vip channel members now can appreciate all the analysis and warnings I posted .
This morning warnings should have helped to ."
336,2022-06-27 15:46:11+00:00,"Don’t overdo the sympathy, but the job is both necessary and demanding https://t.co/nVWN1auV0J"
337,2022-06-27 15:28:02+00:00,The great energy shock is a calamity. But it could also be the moment when better government policy triggers the investment needed to resolve the conflict between having a safer supply of energy and a safer climate https://t.co/mxPKj6WbgK
338,2022-06-27 15:14:00+00:00,"Tech giants, governments, trustbusters, investors: all eyes are on the much-anticipated stockmarket listing of Arm https://t.co/bghg7YPxfZ"
339,2022-06-27 15:03:09+00:00,"The public debate on abortion has become increasingly fraught. 

Yet, when compared with Europeans, many Americans remain uninformed on the issue👇"
340,2022-06-27 14:59:20+00:00,There remain differences among allies over how far to go over Russia https://t.co/nH4BReUQ1v
341,2022-06-27 14:50:02+00:00,@APompliano Don't know of any country that says Bitcoin is a security.
342,2022-06-27 14:45:38+00:00,"@EtudorM Of course, must be... lol..."
343,2022-06-27 14:43:57+00:00,Culture collections offer texts that are frozen in time. Sequence them and researchers can see the changes which led to a disease suddenly spreading or becoming more virulent https://t.co/APWrAXssDR
344,2022-06-27 14:43:14+00:00,Positive headlines! 😂 https://t.co/zOYcUbiAxL
345,2022-06-27 14:32:20+00:00,@blockchainshay which think tanks do you recommend?
346,2022-06-27 14:28:15+00:00,"Charities and UN agencies that have been feeding Afghans and running hospitals have swung into action. But for many of those whose homes have been obliterated, help will come too late https://t.co/34oAo4yNv6"
347,2022-06-27 14:16:35+00:00,A little bit at a time... 🙏 https://t.co/JblDluCS0l
348,2022-06-27 14:13:24+00:00,"@CryptooAdy Luckily, counter to popular opinion, I am not that focused on money. There are many other much more limited resources, health, team, impact, etc."
349,2022-06-27 14:10:09+00:00,Today on “The Intelligence”: a special episode on the Supreme Court abortion-rights ruling that will have dreadful consequences https://t.co/NfIkmuQsaT
350,2022-06-27 14:06:55+00:00,"This week on “Checks and Balance” with @imkahloon, @JamesMAstill and @JohnPrideaux: what is the purpose of the January 6th committee? What new information has it revealed—and can it make a difference? https://t.co/xE2Oo3r02c https://t.co/H700GNyDYN"
351,2022-06-27 13:45:55+00:00,"Things could easily get more complicated than they did in the 1980s if the Fed is unable to act with enough precision to stabilise the market without causing prices to crash 

https://t.co/bOgp64llQO"
352,2022-06-27 13:29:06+00:00,Our US social-affairs correspondent tells “The Intelligence” of the dreadful consequences to come of the Supreme Court’s decision to overturn Roe v Wade https://t.co/aRz6zZtEQl
353,2022-06-27 13:22:28+00:00,"Three reasons suggest the rich world is unlikely to return to the pre-pandemic norm of low, stable price growth any time soon https://t.co/lGJ5cly1Z6"
354,2022-06-27 13:12:22+00:00,"@CryptooAdy Pretty accurate, I think."
355,2022-06-27 13:03:05+00:00,The inquiry is a damning verdict on almost three decades of post-apartheid South Africa https://t.co/DzVImiElac
356,2022-06-27 12:43:06+00:00,"On “The Intelligence” @stevenmazie considers the Supreme Court abortion-rights ruling, and what it means for the court to go squarely against public opinion https://t.co/MsyZjQEDkt"
357,2022-06-27 12:36:24+00:00,"In Arizona, autonomous cars are already out on the roads. But a tragedy in 2018 thrust the technology into the spotlight. 

Can driverless cars ever be safe?

Read more: https://t.co/kQqgMXBurm https://t.co/2x3jnRe2Dx"
358,2022-06-27 12:26:46+00:00,"Satellites capable of pinpoint­ing methane leaks as well as airborne detectors are making strides. There is also a rush to come up with ground­-based technol­ogies for detecting methane 
https://t.co/GExPRhQn7S"
359,2022-06-27 12:08:04+00:00,The solution is obvious: America should reflect five decades of practice and the settled opinion of the majority by passing a national law that guarantees the right to an abortion https://t.co/QzLhTfDZG0
360,2022-06-27 11:47:34+00:00,"At financing costs of 3% or below, Italy can run small primary deficits and still outgrow its debt 
https://t.co/sq1OInLbSw"
361,2022-06-27 11:27:04+00:00,The Supreme Court has never before withdrawn a constitutional right that so many Americans have relied upon for so long https://t.co/XMIDvJ2xqF
362,2022-06-27 11:11:01+00:00,Looks tasty. #BinanceTurns5 https://t.co/bSjBjmzpjW
363,2022-06-27 11:06:31+00:00,Mark Cuban has slashed the cost of drugs to treat conditions ranging from heartburn to cancer https://t.co/XvZCWtN3I9
364,2022-06-27 10:47:07+00:00,"After the fallout of the Supreme Court’s decision, America will be more dangerously divided https://t.co/3paBI6qUvB"
365,2022-06-27 10:27:35+00:00,The World Bank predicts that Kyrgyzstan’s economy will shrink by 5% this year. One big reason is that it expects remittances to fall by nearly a third as migrants lose jobs in Russia https://t.co/C3H0NhItAa
366,2022-06-27 10:22:53+00:00,"♦️ Ukraine’s president addresses the leaders of the G7. 

♦️ Russia defaults on its foreign debt for the first time in more than a century.

♦️ In America several liberal states take measures to protect reproductive rights.

Catch up on the stories that matter👇"
367,2022-06-27 10:07:58+00:00,Britain puts up statues to commemorate black migrants https://t.co/HUbevJtLCG
368,2022-06-27 09:48:45+00:00,Books about football rarely match the drama and beauty of the sport but these five come close https://t.co/llnVLxVqGL
369,2022-06-27 09:29:58+00:00,Hong Kong’s most famous floating restaurant sinks https://t.co/QHSBPNt8uc
370,2022-06-27 09:11:30+00:00,"The fall­ing cost of renewable energy itself is being ampliﬁed by improvements in the technol­ogies of hydrogen manufacture 
https://t.co/BZBDTbLD0y"
371,2022-06-27 08:51:18+00:00,"A new study calls into question the clinical-trial results for Russia’s Sputnik V covid-19 vaccine. The Gamaleya institute, the developer of Sputnik V, disputes the study’s findings https://t.co/KIiBBdrsCI"
372,2022-06-27 08:35:22+00:00,Second-guessing Communist Party censors is becoming part and parcel of doing business https://t.co/Widdvys9Us
373,2022-06-27 08:19:25+00:00,"If the ECB has to raise rates a lot, it will not be able to protect indebted countries such as Italy. The only fix is more collective spending by the euro zone https://t.co/XlUahkMc43"
374,2022-06-27 08:03:47+00:00,"Can a recession be avoided? Nobel prize-winning economist Paul Krugman finds reasons to be hopeful, on “The Economist Asks” podcast https://t.co/pSsUx5PuBQ"
375,2022-06-27 07:58:50+00:00,"@OfficialLionEX @TajoCrypto @WatcherGuru Don't think they want to pay, right?"
376,2022-06-27 07:57:45+00:00,@TajoCrypto @WatcherGuru Lending problems everywhere... 😂
377,2022-06-27 07:43:34+00:00,A partial return to normality from covid-19 has seen many western cities climb the rankings https://t.co/A40cGndY1Y
378,2022-06-27 07:23:35+00:00,"His accuser is biased, but Cyril Ramaphosa still has some explaining to do https://t.co/vJ0Qb8NvbQ"
379,2022-06-27 07:05:09+00:00,"“This time the housing crash will be engineered rather than uncovered,” says @alice_fulwood on this week’s “Money Talks”  https://t.co/h7ZUAqbHPG"
380,2022-06-27 06:44:59+00:00,"As British firms grow, the capital they need dries up along the way. Reallocating pension assets would help https://t.co/UylxKAwqVu"
381,2022-06-27 06:26:57+00:00,As a teenage activist he learned that even if you were trampled and dispersed you could still set something going. Small acts of defiance could grow https://t.co/Zr9pZl9MCr
382,2022-06-27 06:06:48+00:00,Tiverton and Honiton had been one of the Tories’ safest seats. The swing of 30% is an exceptionally poor result https://t.co/dFJZKzF6UN
383,2022-06-27 05:47:07+00:00,"It is not quite impossible to govern without a majority in the National Assembly, but for the next five years Emmanuel Macron will be scratching around for the votes he needs to get anything done https://t.co/64W3RsF04E"
384,2022-06-27 05:28:58+00:00,Europe has gone through a period of remarkable unity recently. Could this carry the EU through a revived euro crisis? https://t.co/HtXxXwHRFJ
385,2022-06-27 05:08:47+00:00,NATO’s new strategic concept identifies Russia as “the most immediate threat to our security” https://t.co/mPyox6drsS
386,2022-06-27 04:50:12+00:00,California pushes back public-school start times https://t.co/b0dif0K6yy
387,2022-06-27 04:31:25+00:00,"Just a few years ago Abiy Ahmed, Ethiopia’s prime minister, seemed to be ushering in a more hopeful era for Ethiopia. That has changed https://t.co/nqG2KP691P"
388,2022-06-27 04:12:53+00:00,"President Jokowi hopes that by repressing conservative Muslims, he will prompt them to moderate their views and protect the country’s pluralism. But his tactics are more likely to anger Muslims and drive extremists underground https://t.co/OuDcHqA8yW"
389,2022-06-27 03:54:37+00:00,What a giant stingray says about the Mekong https://t.co/vsfak2rWEY
390,2022-06-27 03:36:33+00:00,Spain’s second-­biggest and most populous region has long tended to the left. The People’s Party rampaging victory marks a radical shift https://t.co/bC3o1p6f1k
391,2022-06-27 03:14:59+00:00,"Were bitcoin to drop below $15,000, liquidations could accelerate so much that posting enough collateral or raising funds to stop the fall may become hard 

https://t.co/YUv3VdaP7K"
392,2022-06-27 02:54:24+00:00,The ruling will not affect all Americans equally https://t.co/NA7eFrMpPh
393,2022-06-27 02:45:58+00:00,The translation feature is enabled in https://t.co/OpGo10tHCx https://t.co/qTVbl29Rcr
394,2022-06-27 02:34:49+00:00,"Lithium-based technologies may not be able to keep up with energy supply and demand imbalances as renewable penetration rises. But innovators have four other approaches in their sights 
https://t.co/godH3fZDrr"
395,2022-06-27 02:17:40+00:00,"Laws banning abortion will go into effect in 13 states: Arkansas, Idaho, Kentucky, Louisiana, Mississippi, Missouri, North Dakota, Oklahoma, South Dakota, Tennessee, Texas, Utah and Wyoming https://t.co/gzSmxBxHSN"
396,2022-06-27 01:57:52+00:00,The Fujian has an electromagnetic catapult for launching aircraft. This represents a technological leap—and a gamble https://t.co/ju4fpIFfPB
397,2022-06-27 01:50:14+00:00,S&amp;P 500 analysis posted in the telegram channel.
398,2022-06-27 01:37:14+00:00,Many forecasters expect that annual inflation will soon ebb. Yet some indicators point to more price pressure to come in the near term https://t.co/rE3jGP9vUI
399,2022-06-27 01:20:11+00:00,Theoretically the end of Roe should lead to a surge in the number of women heading to states where abortion is still legal. That would channel money to America's remaining abortion clinics. But funding will remain a problem for them https://t.co/Hi13k3cuwe
400,2022-06-27 01:05:59+00:00,"Goodnight everyone .
Let’s see what happens on Monday (tomorrow)."
401,2022-06-27 00:59:15+00:00,America’s uranium firms are salivating over the potential revival of their industry https://t.co/SkiUCzdGsa
402,2022-06-27 00:41:12+00:00,"At a stroke, the court has in effect made terminating a pregnancy illegal in 13 states that have “trigger laws”. This sudden disappearance of abortion provision will cause great harm https://t.co/rZxSYoS5kD"
403,2022-06-27 00:22:45+00:00,That the giant stingray is both massive and alive shows that pockets of the river remain resilient and worth protecting https://t.co/BEQASJlg0z
404,2022-06-27 00:05:08+00:00,"Without vaccines, the study estimates, roughly three times as many people would have died because of covid in 2021 alone https://t.co/G4KWZnHg0Y"
405,2022-06-26 23:44:32+00:00,What to make of China’s new aircraft-carrier https://t.co/IdPVIx3SlT
406,2022-06-26 23:25:35+00:00,"My #btc double analysis of 1 hr happened 100%.
See below what I posted and what happened.
I even said after cme gap closes , market wide dump and that is what happened . https://t.co/XM5eazTzBu"
407,2022-06-26 23:24:01+00:00,Brazil’s Amazon rainforest has become more dangerous https://t.co/jqWAb2T87p
408,2022-06-26 23:05:08+00:00,America and China spar over the Taiwan Strait https://t.co/Cghg8WW95z
409,2022-06-26 22:57:25+00:00,"$jup overbought on the 5,15,30 and 45 minutes . https://t.co/nzFmVJcdzg"
410,2022-06-26 22:44:05+00:00,Politicians in parts of the region are trying to change matters. But in some places sex education has become caught up in the culture wars https://t.co/ONTUSWs31k
411,2022-06-26 22:37:03+00:00,"The best possible outcome is that the Fed manages to slow the property market by enough to bring inflation under control, without overdoing it 
https://t.co/oBwITtD8GK"
412,2022-06-26 22:27:02+00:00,"On “Checks and Balance” this week:
- @JamesMAstill recaps the January 6th committee hearings so far
- @Edanyaperry on the potential criminal consequences
- @SarahLongwell25 on what Republican voters are thinking https://t.co/BOHcpNMizV"
413,2022-06-26 22:26:06+00:00,"By nightfall on June 24th, women in Kentucky and Arkansas had no right to an abortion at any stage of pregnancy—with no exceptions for incest or rape. Anyone who performed one could be charged with a felony https://t.co/j1LIbxnEjm"
414,2022-06-26 22:08:33+00:00,"Called $jup bottom around $.011.
Nice bounce since then . https://t.co/4RTSjWzQMy https://t.co/t9ClI2nSOP"
415,2022-06-26 22:05:05+00:00,The Zondo reports indicate how government policies facilitated corruption. A scheme to transfer wealth to black South Africans was used as an excuse to give contracts to chums https://t.co/1IyPy1qKg3
416,2022-06-26 22:03:43+00:00,How soon $jup on Binance? https://t.co/gIoTuCuBhI
417,2022-06-26 21:53:42+00:00,"You sold $jup.
What would you do it Binance lits $jup tomorrow lol ?
Will you panic buy at $.027? Lol"
418,2022-06-26 21:53:01+00:00,Donald Trump’s pledge in the 2016 presidential campaign—that Roe would “automatically” disappear if he had a chance to reshape the Supreme Court—has been fulfilled https://t.co/ERIKKfjJWo
419,2022-06-26 21:52:05+00:00,"As Russia’s invasion of Ukraine enters its fifth month, NATO leaders will gather in Madrid to prepare the alliance for darker days ahead https://t.co/kEOMxSAIWX"
420,2022-06-26 21:46:00+00:00,"@TheCTjosh @FitFounder I do exercise actually, just not enough, so still not smart. 😂"
421,2022-06-26 21:44:03+00:00,"For most temperaments, buying and holding for the long haul is usually the best policy 
https://t.co/teHElCBiUg"
422,2022-06-26 21:43:46+00:00,"Explaining crypto currencies is like explaining TCP/IP, we shouldn't have to do that. 

Let's build tool so that we won't have to."
423,2022-06-26 21:42:34+00:00,$Jup soon🚀🚀
424,2022-06-26 21:33:01+00:00,"Teens need to sleep longer now, so they can be healthy later https://t.co/jo3ekqK0cP"
425,2022-06-26 21:31:43+00:00,"While people were busy chasing fake pumps , some whales bought over 30 million $Jup between $.01150-$.01120.
They bought more 
Why??? https://t.co/pWNSCqpgds"
426,2022-06-26 21:24:34+00:00,"$jup 1 hr still oversold.
The pump will be on Coinbase pro . Big pump coming . https://t.co/Ibpzr3arjV"
427,2022-06-26 21:21:23+00:00,$jup is going parabolic after panic sellers and weak hands sold . https://t.co/4RTSjWzQMy https://t.co/G3oJBIJwBH
428,2022-06-26 21:20:01+00:00,"My choices: 
new money
hard money
real money
new technology for money
blockchain (industry)
FinTech"
429,2022-06-26 21:16:16+00:00,"$Jup final sellers sold .
The bottom is in.
Major pump coming . https://t.co/NbUFwx56zq"
430,2022-06-26 21:15:34+00:00,"Have had multiple people tell me the word ""crypto"" is not easy for main stream adoption. It convoys a sense of cryptic, hard to understand, mysterious feel to it. Kinda make sense.

What's another word we can use?"
431,2022-06-26 21:13:25+00:00,"@totoroteh_teh @CryptoAlerts365 Or they just don't like new things, like crypto."
432,2022-06-26 21:12:44+00:00,@PinkUnicorn80 @CryptoAlerts365 Would love to see those reports. We can always learn things from those deep feedback. Can also tweet to get them known.
433,2022-06-26 21:10:17+00:00,"@FitFounder Makes a lot of sense when you ""think"" about it. I need to do more. Often gets lazy with travels..."
434,2022-06-26 21:09:16+00:00,@Yousufmahtab Not asking anyone to tattoo. Not a requirement for anything. Just want to know who has already.
435,2022-06-26 21:08:01+00:00,"America’s national anthem served less to reflect than to encourage unity, writes the author of “O Say Can You Hear?” https://t.co/suZBwgBGLt"
436,2022-06-26 21:06:05+00:00,The suppression of “New Portuguese Letters” became the first international feminist cause. Women round the world put pressure on the country’s government by signing petitions and writing letters https://t.co/hIHo9oXdkp
437,2022-06-26 21:04:02+00:00,"As Pet Shop Boys continue their greatest-hits tour, our Back Story columnist muses on their genius—and why their best songs will never get old https://t.co/5w1xXDVVAN"
