,Date,tweet
135,2022-06-29 14:10:07+00:00,"Today on “The Intelligence”: the coming wave of inflation-driven unrest, why Chinese spies are not so spooky and America’s pool of lifeguards dries up https://t.co/Y6bfMVvCRi"
136,2022-06-29 13:51:57+00:00,What effect will the ruling have on elections? There is a chance it could boost turnout among Democrats who might have otherwise been disaffected. That could matter in states where elections are decided by close margins https://t.co/ayfO05J2s0
137,2022-06-29 13:35:07+00:00,America’s pool of lifeguards has dried up. @Rosemarie_Ward tells “The Intelligence” why the risks that poses will last beyond this year https://t.co/J8Qm7ljoxz https://t.co/vo1Gr9oIYo
138,2022-06-29 13:20:22+00:00,"Although this year’s production is expected to fall by one-third, Ukraine’s Grain Association still expects an annual harvest of 26m tonnes of maize, 19m tonnes of wheat, 7m tonnes of barley and 13m tonnes of oilseeds https://t.co/ElNoHzMFUM"
139,2022-06-29 13:14:25+00:00,And how to handle twins...
140,2022-06-29 13:08:42+00:00,@langyacjd Saw a video version of it a few years ago. Hilarious. I am not the Money God (a Chinese thingy). Just a start up guy.
141,2022-06-29 13:01:57+00:00,NATO’s leaders can now concentrate on the pressing business of how to strengthen the alliance in the face of Russia’s invasion of Ukraine https://t.co/SvcnuYhxGZ
142,2022-06-29 12:53:51+00:00,"In CS (customer service) training. Yes, I am being trained by our trainers, again. There is a lot to learn.

Like: don't wear masks when taking selfies for KYC. It won't pass.😆"
143,2022-06-29 12:45:36+00:00,“It’s apparent the Chinese have significant shortcomings when it comes to espionage.” @JNBPage tells “The Intelligence” why their spooks aren’t so spooky https://t.co/368T8NVxE2 https://t.co/a3cg8L5Sho
144,2022-06-29 12:25:44+00:00,The euro zone is at less risk from doom loops than it was ten years ago. But the danger has not disappeared https://t.co/BauOjztDOO
145,2022-06-29 12:05:30+00:00,"After the rally of his supporters outside the White House on January 6th last year, Donald Trump was intent on joining his supporters at the Capitol itself—something he had pledged to do in his speech 
https://t.co/xA4R9NODQ1"
146,2022-06-29 12:00:31+00:00,With fast-growing cities comes increasing food waste. San Francisco has found a solution to the problem https://t.co/mg2nHuG3Om
147,2022-06-29 11:46:03+00:00,"Less than half of the world’s grain harvest is eaten by people
https://t.co/6ULbGLaKAI"
148,2022-06-29 11:41:04+00:00,"“Moods are much tetchier, because belts are tighter.”— @robertguest1 tells “The Intelligence” where to expect inflation-driven unrest in the next year and why https://t.co/KkxBXZgWYh"
149,2022-06-29 11:29:12+00:00,"Party bosses blame a brutal assault on gangsters, rather than endemic sexism https://t.co/eGPsVyyTN7"
150,2022-06-29 11:10:12+00:00,"With his threats to use the bomb, Russia’s president has overturned the nuclear order https://t.co/ZEm5hEIiQz"
151,2022-06-29 10:51:34+00:00,"Since the summer of 2020 economic indicators had tended until recently to surprise on the upside. But as inflation has surged and consumer confidence has flagged, they are now failing to meet forecasters’ expectations https://t.co/UufsjUtRGj"
152,2022-06-29 10:33:08+00:00,"The Kurdistan Workers’ Party, also known as the PKK, has been a thorn in Turkey’s side since 1984, when the group launched an insurgency https://t.co/wDU7xo8tmD"
153,2022-06-29 10:14:12+00:00,The year is 2042. One airline is using a combination of “synthetic” aviation fuel and carbon credits to promote “carbon negative” flights. But is it too good to be true? Listen to “The World Ahead” podcast with @tomstandage https://t.co/y75UABPPL6
154,2022-06-29 10:11:04+00:00,@wmcabangon @binance I wish... 😂
155,2022-06-29 10:09:23+00:00,"@TinovuT @binance It is being worked on, at the highest priority."
156,2022-06-29 10:07:34+00:00,@DavidBTCslayer @binance We support Yubikey.
157,2022-06-29 10:05:59+00:00,"@carlocarlocarl @binance This one, we might not get to for a while. Sorry."
158,2022-06-29 10:05:22+00:00,"@ramondiaz @binance It is back, I think."
159,2022-06-29 09:55:49+00:00,@TajoCrypto @binance Always room to improve.
160,2022-06-29 09:55:18+00:00,Photogrammetry and 3D scanning will aid future rebuilding efforts. They will also help tell the story of the war https://t.co/w85t6yNdeZ
161,2022-06-29 09:55:12+00:00,@ARafayGadit @binance Noted.
162,2022-06-29 09:36:46+00:00,Our Bello columnist on the essential books for understanding Latin America https://t.co/kv4fHOsMZT
163,2022-06-29 09:33:58+00:00,@scupytrooples @binance Our wallet addresses are pretty public. Glassnode and other services track them closely. https://t.co/fkiTzB60AV
164,2022-06-29 09:32:32+00:00,@0xmubaris @binance I suggested this a while back...
165,2022-06-29 09:32:01+00:00,@d_toozer @binance Our process is so strict it's not even funny. But UX still can be improved.
166,2022-06-29 09:30:23+00:00,@Eljaboom @binance P2P trading?
167,2022-06-29 09:29:42+00:00,@Annie_Lordd @binance Binance Card and Binance Pay. Need to expand coverage.
168,2022-06-29 09:29:08+00:00,"@EUR1313 @bitmma @binance IEOs were started at the bottom of the last bear market, Jan 2019, when bitcoin was $3000."
169,2022-06-29 09:28:31+00:00,"@yoldaser @binance haha, bull test?"
170,2022-06-29 09:28:21+00:00,@CryptoAlerts365 @binance Will do.
171,2022-06-29 09:28:00+00:00,"@revolut20 @binance They are earned, not bought. 😉"
172,2022-06-29 09:27:39+00:00,@PC_PR1NCIPAL @binance @EdgeSheet Let's get you a hoodie and a couple of merchs for the good feedback. 🙏 @AlexOnchain
173,2022-06-29 09:18:35+00:00,"“Is it possible to thread the needle, to reconcile energy security and climate security?” Vijay Vaitheeswaran, The Economist’s global energy and climate innovation editor, talks to @alokjha on “Babbage” https://t.co/igGfn79pC3"
174,2022-06-29 09:00:25+00:00,"The fortress was a target from day one, when Russia’s Black Sea flagship arrived at its shores to request the surrender of its tiny guardpost. The garrison’s famously impolite refusal became a rallying cry for the country 
https://t.co/6Whb4FmWTv"
175,2022-06-29 08:59:01+00:00,"♦️ Finland and Sweden will be formally invited to join NATO today. 

♦️ Cassidy Hutchinson testified that Donald Trump wanted to join the crowd on January 6th.

♦️ The European Union has reached a deal on proposals to tackle climate change.

Catch up on the stories that matter👇"
176,2022-06-29 08:39:57+00:00,"Commercial nuclear reactors have not been built to withstand military attack. For that reason, argues the Harvard historian, “we should not build new nuclear plants unless we can find a way to protect existing ones in war” https://t.co/YCvdkgaxty"
177,2022-06-29 08:22:28+00:00,"“There exists a Goldilocks path where we do get the inflation down without a really major rise in unemployment.”

Listen to the Nobel prize-winning economist @paulkrugman, on “The Economist Asks” https://t.co/BUBaFxdr7w"
178,2022-06-29 08:05:14+00:00,"“Lofting”, which dates back to the 1940s, suggests both sides lack modern weaponry https://t.co/7mEk9Pvydu"
179,2022-06-29 07:47:55+00:00,How do you write a history spanning 16 centuries of a country that did not exist as a state until little more than a 150 years ago? From our summer reads collection https://t.co/9ahlucobZ1
180,2022-06-29 07:29:24+00:00,Why no one really wants to see it https://t.co/9KovN7YdKd
181,2022-06-29 07:25:46+00:00,What features or improvements do you most want to see on @Binance?
182,2022-06-29 07:11:06+00:00,But who can keep going longest? https://t.co/CqMeJirxWp
183,2022-06-29 06:52:03+00:00,"In 1986, Czechoslovakia became the first communist country to host the Federation Cup. Martina Navratilova, the world’s number-one tennis player, unsettled the regime. From 1843 magazine’s archive https://t.co/kHV3Zcmxus"
184,2022-06-29 06:31:51+00:00,"Logging in, deleting emails, mistyping things. It all adds up https://t.co/QwSWF4cnPp"
185,2022-06-29 06:11:55+00:00,Barristers in criminal cases have gone on strike across England and Wales. In February we argued that the government pays solicitors and barristers too little for legal-aid work https://t.co/xDxiZyKjZj
186,2022-06-29 05:52:41+00:00,"Just as Vladimir Putin argues Ukraine and Russia are “one nation”, so China maintains Taiwan is now and has always been “part of China” https://t.co/fldygbSHAw"
187,2022-06-29 05:35:22+00:00,Throwing billions at a breakaway golf tour will not polish the kingdom’s image https://t.co/zLbqLXKCSo
188,2022-06-29 05:15:46+00:00,More people attempting the journey is just one reason why deaths have risen. The other is that crossing at America’s border with Mexico has become more perilous https://t.co/I09dCK8qFx
189,2022-06-29 04:55:38+00:00,"By reviving modernist buildings in Vietnam, local architects are paying homage to a rich architectural legacy—and setting a standard for green building techniques https://t.co/5MEyBWZV9T"
190,2022-06-29 04:35:03+00:00,"The continent needs places where anyone can picnic, hang out or even protest https://t.co/psAe4zLBK6"
191,2022-06-29 04:16:54+00:00,Humans ate just 13% of global maize output in 2019 https://t.co/NWas3YEJEm
192,2022-06-29 03:57:06+00:00,Are you fluent in D3? Can you design and build data-rich applications? We’re hiring an interactive visual journalist https://t.co/HDLD9uf8Cz
193,2022-06-29 03:35:18+00:00,The revival of NATO as the world’s most successful alliance risks being overshadowed by Recep Tayyip Erdogan’s obstructionism https://t.co/Qp60baoL9f
194,2022-06-29 03:13:11+00:00,"Across nearly 5,500 pages the report underlines how, having helped make the country a democracy, the ANC proceeded to debase it https://t.co/8Zm9U03oTI"
195,2022-06-29 02:51:14+00:00,But legal changes in both countries may help South Korea reclaim its crown https://t.co/FsI9iVNEVe
196,2022-06-29 02:29:18+00:00,"Virtual private networks help internet users in China get around the “great firewall”, which has been reinforced under President Xi Jinping 

https://t.co/QTIcQXEl5g"
197,2022-06-29 02:07:49+00:00,"Some buildings should be retrofitted, others torn down https://t.co/uXMF13J5sl"
198,2022-06-29 01:50:31+00:00,It could put some less efficient ones out of business https://t.co/GhvAJIBg5V
199,2022-06-29 01:32:59+00:00,"The state is reshaping one of the world’s biggest startup scenes—not necessarily for the better 
https://t.co/2dxOkHrll1"
200,2022-06-29 01:10:31+00:00,"As illegal crossings at America’s border with Mexico have surged, so has the number of deaths https://t.co/Xf9M2IIObY"
201,2022-06-29 00:51:03+00:00,"“We should use every tool in our toolbox to alleviate human suffering,” argues @LindaT_G, America’s ambassador to the UN. In a guest essay, she explains how specialised digital tools can be used to fight hunger https://t.co/GdlyBMiKOu"
202,2022-06-29 00:33:07+00:00,"A new law requires all public high schools to start no earlier than 8:30am, half an hour later than the American average. Middle schools (ages 11-14) must start at 8am or later https://t.co/Z3f57He8I1"
203,2022-06-29 00:27:02+00:00,Justice Samuel Alito argued that “Roe ‘inflamed’ a national issue that has remained bitterly divisive for the past half century.” Yet the unmaking of Roe seems unlikely to be anything less bitter https://t.co/JDYitTitrt
204,2022-06-29 00:24:21+00:00,There is little that President Joe Biden can do for Democrats distraught over the Supreme Court’s ruling https://t.co/XFCuE7VW4B
205,2022-06-29 00:05:15+00:00,"We look at the world’s startups and identify the safe, the uneasy and the doomed https://t.co/NavAQVPCfR"
206,2022-06-28 23:46:33+00:00,Russia’s invasion of Ukraine has drawn new attention to Taiwan’s precarious international position. Discover our recommendations for books on the issue https://t.co/Gel9kZMsui
207,2022-06-28 23:27:33+00:00,Two developments have transformed election administration from a mostly bureaucratic endeavour into a partisan battleground https://t.co/x1d2L3BMDN
208,2022-06-28 23:08:05+00:00,Soaring food and fuel prices are adding to pre-existing grievances https://t.co/iU6EIFk9cY
209,2022-06-28 22:49:48+00:00,The war in Ukraine has exposed the vehicle’s vulnerabilities. They can be overcome https://t.co/ZsKxxSs7Jo
210,2022-06-28 22:30:02+00:00,A formal invitation to join will be issued to Finland and Sweden. But the months required for NATO’s 30 allies to ratify their accession leaves plenty of scope for disagreements https://t.co/MGqqdlL0es
211,2022-06-28 22:17:30+00:00,"Party bosses blame a brutal assault on gangsters, rather than endemic sexism https://t.co/SgG7GtWOv7"
212,2022-06-28 21:57:59+00:00,But Recep Tayyip Erdogan takes home a victory https://t.co/PWon8IAgi7
213,2022-06-28 21:49:33+00:00,How to fix the world’s energy emergency without wrecking the environment https://t.co/gA2Dv6O5CC
214,2022-06-28 21:27:56+00:00,Inside Britain’s national culture collections https://t.co/Iu1epMkopY
215,2022-06-28 21:17:54+00:00,@crypto_pinapple Hold is never easy. You did well.
216,2022-06-28 21:10:04+00:00,"@chidibando @CryptooAdy Not sure about that, but I do believe in simulation theory."
217,2022-06-28 21:08:13+00:00,America’s Supreme Court requires Maine to include religious schools in a tuition programme https://t.co/7SeBmywxsV
218,2022-06-28 21:02:49+00:00,Users are not dumb. https://t.co/YmtjFWa1FN
219,2022-06-28 20:48:41+00:00,"“They certainly seem to be circling in on the possibility of actors who were involved in the so-called seditious conspiracy.” 

On “Checks and Balance”, @Edanyaperry examines the possible criminal charges being laid out by the January 6th committee https://t.co/Ykl7BNYI0I"
220,2022-06-28 20:27:49+00:00,NATO is limbering up strategically and militarily. All this adds up to a remarkable revival for the alliance https://t.co/hJsqzEBlmF
221,2022-06-28 20:11:16+00:00,The tragedy was one of the deadliest incidents in recent decades related to people-smuggling along America’s border with Mexico—among the most lethal land borders in the world https://t.co/TUzaL4fKLq
222,2022-06-28 19:28:37+00:00,"Which technologies will enable the green transition, while ensuring energy security, too? Vijay Vaitheeswaran, The Economist’s global energy and climate innovation editor, joins @alokjha on “Babbage”, our podcast about science and technology https://t.co/AwobxFbgfc"
223,2022-06-28 19:27:27+00:00,"“The type of acceleration in house prices that we’ve seen...over the past two years is unprecedented,” says @dallasfed economist Enrique Martinez-Garcia. On this week’s “Money Talks” podcast: is a crash on the way? https://t.co/U4pCtGFVXP"
224,2022-06-28 19:07:02+00:00,That local officials are turning routine administrative tasks into partisan judgments may portend wider problems https://t.co/iUmwmLrtEV
225,2022-06-28 18:59:15+00:00,We’re looking for an interactive visual journalist to join The Economist’s data team. Apply by July 15th https://t.co/ad44c0UsOl
226,2022-06-28 18:37:45+00:00,The idea is to make drugs affordable to the 31m Americans who lack health insurance and the many more whose policies make them pay hefty fees for prescriptions https://t.co/yAMFnqvIEZ
227,2022-06-28 18:16:35+00:00,"Virtual private networks are becoming increasingly important in China, which has grown more inward-looking since the start of the pandemic 
https://t.co/YWGE8RM0jB"
228,2022-06-28 17:55:03+00:00,"Are you an audio producer passionate about communicating what developments and trends in finance, business and economics mean for the world? We’d like to hear from you https://t.co/PfRHRXKsz4"
229,2022-06-28 17:36:38+00:00,Our BAFTA award-winning films department is looking for a highly skilled and talented Executive Producer. Fit the bill? Apply by July 1st https://t.co/zFNkXOVkHv
230,2022-06-28 17:16:07+00:00,"Following the ban on players from Russia and Belarus at Wimbledon, dip into 1843 magazine’s archive to go back in time to the 1986 Federation Cup, where something more than a tennis match took place https://t.co/2BMNnfMLZW"
231,2022-06-28 17:08:06+00:00,@binance_raj @bnb_teddy @elonmusk @Hisbenjaminkaka @artists_voyage @AnalystShaq @SomeCrypt0Guy @bsc_daily that tattoo looks real and fresh!
232,2022-06-28 17:07:09+00:00,"@LayahHeilpern Depending on the conversation, I often just tell people I work on a website. Much easier, haha."
233,2022-06-28 16:57:50+00:00,"The dual aim of guidance funds is to counter the “disorderly expansion of capital” and to fulfil President Xi Jinping’s desire for home-grown innovations in strategic areas such as artificial intelligence 
https://t.co/qVSGW3D1YA"
234,2022-06-28 16:36:39+00:00,"On “The World Ahead” podcast, @tomstandage travels to 2042 to find airlines making growing use of “synthetic” aviation fuel, made using CO2 extracted from the atmosphere, which allows for carbon-neutral flights https://t.co/pRhsxnmvC9"
235,2022-06-28 16:15:22+00:00,"Barristers in criminal cases have gone on strike across England and Wales. Earlier this year we explained why, unless lawyers are paid better, courts will grind to a halt https://t.co/PyjAIRQvEM"
236,2022-06-28 15:57:04+00:00,"Turkey’s president, Recep Tayyip Erdogan, has sworn to block membership bids by Finland and Sweden, accusing them of harbouring terrorists https://t.co/mFfgQvIdHv"
237,2022-06-28 15:56:27+00:00,"It is well known that markets hate uncertainty. Bad news, then, that by one measure the world economy is throwing up more nasty surprises for investors https://t.co/utDBC8GscT"
238,2022-06-28 15:56:02+00:00,"@BscPitbull_TR @aantonop @binance Compare this audience to 2013, you know why the OGs are not worried about #bitcoin."
239,2022-06-28 15:54:09+00:00,"@DWorc @aantonop yeah, looks like he doesn't tweet much now. He used to be super active."
240,2022-06-28 15:46:17+00:00,"Respect to @aantonop! 

Back in the day, a 20 people audience is a good crowd. We came a long way. 

Compared to that, people today are worried about #bitcoin's future at $20,000. 😂 https://t.co/PYk1jrRRjk"
241,2022-06-28 15:35:26+00:00,"“What we’re really worried about, always, is inflation that feeds on itself.” 

@paulkrugman speaks to us on “The Economist Asks” podcast https://t.co/uvm4ootgBr"
242,2022-06-28 15:15:30+00:00,"In Missouri, legislators are pitching laws to prevent women from travelling out of state for abortions https://t.co/X4ebb1tEFJ"
243,2022-06-28 14:56:23+00:00,We are looking for an early-career interactive journalist to join our London-based data team https://t.co/F6y1JqCzft
244,2022-06-28 14:40:41+00:00,Perhaps the biggest challenge of all for NATO is working out the alliance’s proper role in Ukraine https://t.co/OG2AQSH9Ix
245,2022-06-28 14:25:23+00:00,“Trump seems to poll better the more he recedes from the public imagination.” @SarahLongwell25 breaks down how Trump voters are viewing the January 6th committee on “Checks and Balance” https://t.co/XrWXqEzpE6 https://t.co/aYnZbVYCTv
246,2022-06-28 14:08:16+00:00,"Today on “The Intelligence”: a re-energised NATO works up a new game plan, the property sector’s carbon footprint and remembering a steely Ukrainian activist https://t.co/r8S2dkOSeV"
247,2022-06-28 13:47:06+00:00,Roman Ratushny saved a pristine strip of forest in his native Kyiv. On “The Intelligence” we look back on a life cut short by a far larger fight to save what he loved https://t.co/jd4u93XCkC https://t.co/MdS6c7Rs0e
248,2022-06-28 13:32:39+00:00,Local architects are drawing on the movement’s features and inherently sustainable design to enhance contemporary projects in Ho Chi Minh city and Hanoi https://t.co/Uw28kNbsAG
249,2022-06-28 13:28:17+00:00,@AxieInfinity good job. 👍
250,2022-06-28 13:13:25+00:00,Two recent rulings mark a fundamental departure from the position of the court just a few decades ago https://t.co/X3H7Vrn7yU
251,2022-06-28 12:55:14+00:00,Where does your city rank? https://t.co/Trzlo5WS1U
252,2022-06-28 12:36:32+00:00,"The property sector is responsible for a staggering amount of emissions. If climate targets are to be met, @VinjeruM tells “The Intelligence”, it needs drastic change https://t.co/0jLBtVRl5U https://t.co/gEyfgwLEEi"
253,2022-06-28 12:19:15+00:00,"Italy exerts a special allure in the English-speaking world and beyond: superficially as accessible as it is delightful, and yet tinged with intrigue and mystery. Discover our top recommendations for books about the country https://t.co/nvZd3PTJ5Z"
254,2022-06-28 12:00:30+00:00,Ageing populations are fast becoming an unsustainable problem for the rich world. How can society afford the costs? https://t.co/cURrAqEywb
255,2022-06-28 11:59:04+00:00,"“Cooling the housing market is almost a precondition to be able to tame inflation,” @dallasfed economist Enrique Martinez-Garcia tells @Alice_Fulwood on this week’s “Money Talks” podcast https://t.co/KlR7anaehI"
256,2022-06-28 11:40:22+00:00,“We’re seeing a remarkable re-arming of Europe—all thanks to Vladimir Putin.” @shashj tells “The Intelligence” why this week’s @NATO summit matters https://t.co/R1s2NhVoFV
257,2022-06-28 11:21:19+00:00,The lion’s share of the world's grain production goes to animals https://t.co/QfP0UyWlYs
258,2022-06-28 11:03:13+00:00,A country is at risk of a doom loop when a shock to one part of its economic system is amplified by its effect on another https://t.co/sBGJ3dbvgs
259,2022-06-28 10:44:56+00:00,Biden’s gas-tax break is tempting politically but it’s a bad idea https://t.co/m9j88RMJ8V
260,2022-06-28 10:21:30+00:00,@BTC_Archive Is this true?
261,2022-06-28 10:06:45+00:00,Saudi Arabia still thinks money can buy a new reputation https://t.co/NIv2wGk7py
262,2022-06-28 09:46:57+00:00,"For a rock just twice the size of Alcatraz, Snake Island has played a surprisingly big role in the war in Ukraine 
https://t.co/fPbau3WMPE"
263,2022-06-28 09:27:32+00:00,"In peacetime Ukraine exported 6m tonnes of grain per month, most of which went through ports on the Black Sea. But a Russian naval blockade, and waters littered with Ukrainian defensive mines, have halted that trade https://t.co/zM7H6civNI"
264,2022-06-28 09:23:46+00:00,"@spideycyp_155 Got this from another friend, lol... https://t.co/3Mdyz3AOBs"
265,2022-06-28 09:08:00+00:00,Are you fascinated by American politics and current affairs? Interested in working with the team that runs this account? We want to hear from you https://t.co/rjv65karrx
266,2022-06-28 08:48:41+00:00,"Perhaps the most transformative technology is chemical stor­age, which uses electricity to make a chemical which can later be used in a generator or engine 

https://t.co/rhlYp2ctjN"
267,2022-06-28 08:29:39+00:00,The challenge of coastal erosion in Britain https://t.co/cvqdbTJArk
268,2022-06-28 08:13:16+00:00,"Just remember, adoption growth curve is exponential.

No one wants to be first, even fewer can afford to be last.

 » Report: Morocco’s Central Bank to Unveil Crypto Regulation Bill Soon https://t.co/vYwivtLhXR"
269,2022-06-28 08:10:42+00:00,"It is probably the case from the get-go, with people picking friends at least partly on the basis of body odour, rather than the body odours of people who become friends subsequently converging 
https://t.co/ROyLVj2ulQ"
270,2022-06-28 08:10:06+00:00,"@UdyHighs @lillyvivvi I was just shocked at the number, lol..."
271,2022-06-28 07:51:58+00:00,Italy is the latest victim of Ukraine-related divisions https://t.co/wQtk051Loc
272,2022-06-28 07:33:25+00:00,How can governments fight inflation? The Nobel prize-winning economist @paulkrugman talks to @AnneMcElvoy and @Henry_Curr on “The Economist Asks” podcast https://t.co/e2tGESRP44
273,2022-06-28 07:13:16+00:00,"Around 100 countries failed to reach the World Health Organisation’s goal of vaccinating 40% of their eligible populations by the end of 2021. The researchers estimate that this cost around 600,000 lives https://t.co/wQJ3dBLmlp"
274,2022-06-28 06:54:51+00:00,How Russia’s war could revive America’s uranium industry https://t.co/HxrnkTJbmJ
275,2022-06-28 06:52:37+00:00,Money is not a limited resource.
276,2022-06-28 06:52:07+00:00,The most limited resource in the world are entrepreneurs.
277,2022-06-28 06:44:25+00:00,"@depression2019 When most think this way, it would be time..."
278,2022-06-28 06:43:58+00:00,@lillyvivvi Need that much?
279,2022-06-28 06:37:11+00:00,"In tough times, communicate with your community more frequently, every few hours."
280,2022-06-28 06:36:18+00:00,"For a sense of the multifaceted approach to energy infrastructure that climate action makes necessary and technolo­gy makes possible, look to Germany, where firms are already looking towards running on hydrogen 
https://t.co/cL2Y1Rnz2i"
281,2022-06-28 06:36:03+00:00,@gautamchhugani same here... 😂
282,2022-06-28 06:17:32+00:00,The women who challenged Portugal’s dictatorship https://t.co/AsaDXmpd5i
283,2022-06-28 05:59:13+00:00,The curious history of America’s national anthem https://t.co/yeWsYMZmxf
284,2022-06-28 05:53:33+00:00,» Solana’s Biggest DeFi Lender Almost Got Rekt. Then Binance Stepped In https://t.co/W11KNUujl3
285,2022-06-28 05:40:45+00:00,The Biden-Harris problem https://t.co/HCIWs4fhen
286,2022-06-28 05:21:44+00:00,Vietnamese modernist architects added “bioclimatic” features such as ventilation shades and exterior corridors to regulate the temperature inside buildings https://t.co/houhWgq8OZ
287,2022-06-28 05:02:48+00:00,"NATO is establishing further battlegroups in Bulgaria, Hungary, Romania and Slovakia, reflecting the growing threat further south, around Ukraine’s borders and near the Black Sea https://t.co/3B2ecD1fr9"
