,Date,tweet
438,2022-06-26 21:03:08+00:00,"Fintech’s woes are in stark contrast to the exuberance of 2021, which was fuelled by the surge in digital finance and investors’ hunt for returns https://t.co/Gm2tBvPiuG"
439,2022-06-26 20:53:01+00:00,The bad news on inflation just keeps coming. What consumer prices do next is one of the most important questions for the global economy https://t.co/Ja3stzEnuy
440,2022-06-26 20:45:07+00:00,"As Brazil has become a big consumer and exporter of cocaine, organised crime has spread across the Amazon https://t.co/81i75h5rKK"
441,2022-06-26 20:42:01+00:00,"Shortly after Russia invaded Ukraine, he became a go-to man to organise resistance, drawing in others and offering their services to any commander who could use them https://t.co/zPsrmKOZD6"
442,2022-06-26 20:29:03+00:00,This is not the first time the administration has muddled its terms in an effort to embrace trans rights. It has done so over sex and gender identity too https://t.co/Z4DCYCZVZQ
443,2022-06-26 20:22:51+00:00,"@OurBlackman Never late, I knew you have one already. Good pics though."
444,2022-06-26 20:21:56+00:00,@b_nerd9 #BTC is truly more decentralized in this aspect.
445,2022-06-26 20:21:00+00:00,"@spongebobcoin @OziAcademy no, don't put it on your forehead."
446,2022-06-26 20:16:31+00:00,@humblebearxbt Only do it if it is meaningful enough to you already.
447,2022-06-26 20:16:04+00:00,"No Western country has a workforce with experience in making nuclear power plants both well and quickly. This results in failure reinforcing failure. Breaking this cycle requires both better building and new ﬁnancing models 
https://t.co/AxeQszlwvR"
448,2022-06-26 20:15:04+00:00,"As a result of Italy’s reliance on Russian gas, shortages threaten in winter. This will influence elections due next year https://t.co/lInZromZBV"
449,2022-06-26 20:12:47+00:00,#btc cme gap filled !
450,2022-06-26 20:07:59+00:00,"@JuanLazyPLE Oh, that's a cool way to do it."
451,2022-06-26 20:07:24+00:00,@binance_kid @binance nice!
452,2022-06-26 20:06:09+00:00,@ToRiKaN cool
453,2022-06-26 20:00:12+00:00,@mardino0447 @Marcelo13784792 Almost... haha
454,2022-06-26 19:59:47+00:00,@Marcelo13784792 nice!
455,2022-06-26 19:57:05+00:00,"Averting the coming explosions will be hard. The IMF should be generous, but strict. And it should act quickly 
https://t.co/rIEqKGqWMF"
456,2022-06-26 19:53:39+00:00,"@MuhammadDaudSu6 No, only get it if it is already meaningful to you."
457,2022-06-26 19:53:07+00:00,"In mainstream finance, regulators provide a safety-net. But no institution exists to mop up stressed crypto assets  
https://t.co/YaBXSNldA5"
458,2022-06-26 19:53:06+00:00,@HassanSl98 cool
459,2022-06-26 19:52:12+00:00,@raffoulig that's good too.
460,2022-06-26 19:51:42+00:00,"@GundemGuven I know 8-9 people who has it, starting to lose count now..."
461,2022-06-26 19:49:58+00:00,@Marcelo13784792 when did you get this one?
462,2022-06-26 19:48:36+00:00,"@wldrade I know this arm. belongs to Luke, co-founder of @CoinMarketCap"
463,2022-06-26 19:48:05+00:00,@rbaardela that's pretty sick too.
464,2022-06-26 19:45:36+00:00,"@BTC_Archive yup, once you try it, you will know how it benefits the economy."
465,2022-06-26 19:45:10+00:00,"If you have a #BNB tattoo, post a few pics below. 

Real tats, not photoshops or hana tattos, please. https://t.co/TNJSLD0HgA"
466,2022-06-26 19:40:03+00:00,@aleekk0 @bnb_teddy @EtudorM @binance @Hisbenjaminkaka @sikanderali_ @artists_voyage @BinanceAngels @BNBTC_on_BSC Just saw that. Thanks for the support!
467,2022-06-26 19:28:59+00:00,@HassanSl98 @binance when did you get this one?
468,2022-06-26 19:28:06+00:00,"Chinese internet platforms will be required to review user comments before they are posted, according a recently unveiled draft rule https://t.co/TRy1GcZXyc"
469,2022-06-26 19:27:02+00:00,Management is not a heroic calling. There is no Marvel character called “Captain Slide Deck”. But teams need leaders https://t.co/JifMfcihdu
470,2022-06-26 19:26:13+00:00,@ArtOfHeroes @binance when did you get this?
471,2022-06-26 19:19:04+00:00,The stimulative effect of bond-buying is unhelpful when inflation is too high https://t.co/kjN1b7fBX1
472,2022-06-26 19:11:51+00:00,Manhattan’s halal carts offer more than a sizzling skewer and a smile: they are living records of New York’s changing habits and demography https://t.co/rSMNyNQoxX
473,2022-06-26 18:52:56+00:00,"Do you see the exact same pattern of $lunc and $jup?
$lunc took off.
$jup is next 🚀 https://t.co/KPgYo9jaKI"
474,2022-06-26 18:51:02+00:00,"“There exists a Goldilocks path where we do get the inflation down without a really major rise in unemployment.”

Listen to the Nobel prize-winning economist @paulkrugman, on “The Economist Asks” https://t.co/GAOBG3xJfl"
475,2022-06-26 18:49:06+00:00,"“Last year two journalists were murdered. Others have been hounded out of the country.”

@TomGardner18 on the Ethiopian government’s repression of free speech https://t.co/SwjqGID0Ft"
476,2022-06-26 18:47:03+00:00,"Less Jupiter than Icarus, Emmanuel Macron came crashing down this week https://t.co/ieIXkL0DI2"
477,2022-06-26 18:45:15+00:00,"You missed $lunc pump ?
Don’t miss $jup. https://t.co/BnzpjyqvxF"
478,2022-06-26 18:44:04+00:00,"The study found that in the first year of vaccine rollout, jabs saved the lives of 19.1m-20.4m people https://t.co/ZWKoDVO3M3"
479,2022-06-26 18:40:17+00:00,Still have my 17 million $LunC ponzi lol https://t.co/8Vrqnhjz5c
480,2022-06-26 18:33:10+00:00,"Hits such as “It’s a Sin” and “West End Girls” teleport Pet Shop Boys’ older listeners to their youth, a thrill even if those years were hard https://t.co/7dF7ptzNtV"
481,2022-06-26 18:24:55+00:00,"Good luck if you chased $Swftc fake pump .
Many people are already trapped.
See below 1-2 hrs charts . It’s inevitably going down . https://t.co/VI1FyxUwo1"
482,2022-06-26 18:21:49+00:00,"I did warn you all but as usual most people love to chase the fake pumps.
Most people get trapped .
✅late longs , late buyers and those who followed moonboys will soon get punished.
Everything has been explained in detail in vip channel.
4 hr time frame target has been given . https://t.co/QsKq8bkcHN"
483,2022-06-26 18:18:03+00:00,The conservative People’s Party recent national rebound in Spain has only managed to bring it level with the Socialists in the polls https://t.co/FduAOlJKnK
484,2022-06-26 18:08:07+00:00,"For the third time in the past five years, Vienna has ranked top of the @TheEIU’s liveability index. Find out where your city sits on the list https://t.co/DS4xG3jrkE"
485,2022-06-26 18:06:04+00:00,"Boris Johnson insisted they were nothing more than run-of-the-mill results. In truth, they signal serious difficulties for Britain’s government https://t.co/AXlaYhCTqg"
486,2022-06-26 17:59:22+00:00,@DeeDeeShib It’s in my page right below my bio
487,2022-06-26 17:58:54+00:00,"Alert vip channel members :
All of these will be discussed later .
#btc , $alts . https://t.co/idF6u1sesF"
488,2022-06-26 17:54:56+00:00,"Someone has been buying $jup a lot .
The $jup pump on Coinbase pro will be major 🚀🚀"
489,2022-06-26 17:49:35+00:00,@DeeDeeShib Posted in the telegram
490,2022-06-26 17:45:08+00:00,Britain is a good place to be a budding entrepreneur. But it is not a good place to turn promising startups into titans https://t.co/qsIXp73MyJ
491,2022-06-26 17:40:59+00:00,"1 hr analysis posted in the vip telegram channel.
As I said , I was extremely clear.
I said a bounce first and then dump to $21k.
Exactly as I predicted.
No matter what , my analysis will happen.
Pay attention to my 2-4 hrs and daily analysis people . https://t.co/p5RqLr7wxt"
492,2022-06-26 17:37:03+00:00,"Here is an example of how in detail I explain and analysis.
Posted detail a analysis of #btc with charts 
✅called for a bounce and then $21k.
✅explained about cme gap.
15 minute was oversold. It bounced.
1 hr was overbought and it dumped to $21.1k exactly as I predicted. https://t.co/11GZDzAKWL"
493,2022-06-26 17:30:03+00:00,An IPO is bound to set consultants’ hearts racing. But they should think twice before they leap into the lion’s den https://t.co/Ut9JY6pJhV
494,2022-06-26 17:26:42+00:00,"$jup 1 hr is now again oversold. It’s now oversold on the 15,30,45 minutes and 1-4 hrs . At all time frames 
Interestingly it got to oversold but kept MACD bullish . 1 hr MACD didn’t cross bearish while stochastic rsi came down to zero. https://t.co/cfNx9u1hq2"
495,2022-06-26 17:19:48+00:00,Manhattan’s halal carts offer more than a sizzling skewer and a smile: they are living records of New York’s changing habits and demography https://t.co/nglcuoRV3z
496,2022-06-26 17:01:52+00:00,"Whatever Arm’s fate—as a public company, a state-controlled one or the ward of a consortium of chip-industry heavyweights—its future will probably resemble its past: vital but, by Silicon Valley standards, a minnow https://t.co/Ba5AyZZwem"
497,2022-06-26 17:00:39+00:00,@bnb_teddy @EtudorM @binance @Hisbenjaminkaka @sikanderali_ @artists_voyage @BinanceAngels @BNBTC_on_BSC real tattoo?
498,2022-06-26 16:46:01+00:00,It is the most sweeping reversal of a constitutional right in American history https://t.co/A1f9Z1nxai
499,2022-06-26 16:40:08+00:00,"A vicious cycle in countries’ financial systems has analysts worried
https://t.co/cEEDW3iBkP"
500,2022-06-26 16:36:07+00:00,"The politics of disavowing Russian uranium may look good on paper, but they could leave utilities and innovators like TerraPower in the lurch https://t.co/wG3KIaNpmB"
501,2022-06-26 16:26:04+00:00,"Elvis Presley died almost 45 years ago. He is reborn in “Elvis”, a film directed with typical over-the-top brio by Baz Luhrmann https://t.co/qaL2QWEoFi"
502,2022-06-26 16:21:05+00:00,"For a sense of the multifaceted approach to energy infrastructure that climate action makes necessary and technolo­gy makes possible, look to Germany, where firms are already looking towards running on hydrogen https://t.co/fznBUEvCFL"
503,2022-06-26 16:16:04+00:00,"Slovenia’s new foreign minister worries that making Ukraine an official candidate to join the EU will suggest to countries in the western Balkans that accession rests on politics, rather than reform https://t.co/OCAHHhH1rB"
504,2022-06-26 16:12:05+00:00,"With so much emotional capital invested, it is little wonder that their fans are mourning. A confessional streak strengthened their bond with young fans struggling to forge an identity for themselves https://t.co/Ks63VVJNKZ"
505,2022-06-26 16:08:02+00:00,"America, which sets out to be a beacon for democracy and freedom, has taken a dangerous step towards oppression. A constitutional right granted almost half a century ago has been torn up https://t.co/kS0wBDuXp1"
506,2022-06-26 16:06:06+00:00,“New Portuguese Letters” was published in 1972. A section on abortion might profitably be read by American judges today https://t.co/Th8FojE7ow
507,2022-06-26 15:57:04+00:00,"Mortgage rates across the world are rising, as central banks try to rein in inflation. So is another housing crash on the horizon? Find out on this week’s “Money Talks” podcast https://t.co/Zszi35z1Ow"
508,2022-06-26 15:48:06+00:00,"The use of abortion medication is increasing in America. Yet however prevalent it becomes, some women will always need to use clinics, says Leah Coplon of the Abortion Care Network https://t.co/OUrvmtJttA"
509,2022-06-26 15:29:02+00:00,A new study finds that Mark Cuban’s prices might have saved Medicare $3.6bn on $9.6bn-worth of drugs it had bought in 2020 https://t.co/pFN6ATQaqZ
510,2022-06-26 15:23:03+00:00,"In calling for the tax holiday, Joe Biden said it would at least provide families with “a little bit of breathing room”. Perhaps he hopes it would provide the same for his presidency https://t.co/g0voWFdTgP"
511,2022-06-26 15:20:05+00:00,"Researchers have shown that clinical-trial results for Russia’s Sputnik V covid-19 vaccine contain some numbers which are extremely unlikely to occur. The Gamaleya Institute, the developer of the vaccine, disputes these findings https://t.co/97oShclFUR"
512,2022-06-26 15:14:03+00:00,"Unlike viewers of a TV drama who rightly suspect that the good guys will be protected by “plot armour”, sports fans cannot be certain of the result. The players write the script before their eyes https://t.co/EhVRL5sExt"
513,2022-06-26 15:07:05+00:00,"The music itself was written around 1778 by John Stafford Smith, an Englishman. Francis Scott Key, a lawyer with a contradictory record on slavery, wrote the words in 1814 https://t.co/yaLLltKkRg"
514,2022-06-26 15:02:08+00:00,Throwing billions at a breakaway golf tour will not polish the kingdom’s image. There are better ways to do so https://t.co/vBCCfzq5fb
515,2022-06-26 15:02:08+00:00,"Pet Shop Boys’ best songs at once echo your woes and make you feel better—a feat that only words and music can perform, and only rarely https://t.co/zlatikrvPU"
516,2022-06-26 14:30:06+00:00,"Finland stands, for now, as the only country to have built a complete deep geological storage facility https://t.co/ume9tqzcc9"
517,2022-06-26 14:26:02+00:00,“Trump seems to poll better the more he recedes from the public imagination.” @SarahLongwell25 breaks down how Trump voters are viewing the January 6th committee on “Checks and Balance” https://t.co/w6B3gg8HpG https://t.co/UMVVMHACfe
518,2022-06-26 14:19:04+00:00,"How will technology redefine education? 

Tom Standage travels to the year 2042 to find that “learning assistants” powered by artificial intelligence allow pupils to progress at a pace that suits them. Listen to “The World Ahead” https://t.co/xq8wTgTtOe"
519,2022-06-26 14:14:03+00:00,"Do you like the sound of turning The Economist’s reporting into gripping, can’t-miss stories that people watch from beginning to end? We’re looking for an Executive Producer to join our BAFTA award-winning films team https://t.co/r7nvTly51Y"
520,2022-06-26 14:00:48+00:00,The discovery of the world’s biggest freshwater fish points to improving relations between fishermen and conservationists. Her captor could have sold her as food. Instead he called a conservation group https://t.co/ToKD5SYDzR
521,2022-06-26 13:38:56+00:00,"“In the short time since I left in May, many Ethiopian journalists and activists have been detained.”

Expelled from Ethiopia last month, our correspondent @TomGardner18 explains the crackdown on press freedom there https://t.co/JHxSiHuDgr"
522,2022-06-26 13:19:05+00:00,Among the celebrity strains in the National Collection of Type Cultures is a dose of Haemophilus influenzae believed to have come from Alexander Fleming’s own nose https://t.co/yyKdLQOIcF
523,2022-06-26 13:15:10+00:00,It takes less than 1 day of (crypto experienced) engineering work to integrate with Binance Pay.
524,2022-06-26 13:14:03+00:00,The economic fallout from the pandemic and the war in Ukraine will revive old debates that tend to tear Europe apart https://t.co/3tlBoZGPn7
525,2022-06-26 13:12:42+00:00,@kapildevtmkr up to... typo
526,2022-06-26 13:10:26+00:00,"@CryptoAlerts365 Not that bad. Look at it this way...

Negative coverage = they may not like you, but can't stop talking about you. Still coverage.

No coverage = you are not worth talking about."
527,2022-06-26 13:08:32+00:00,@kapildevtmkr I know sports will definitely use NFTs in the foreseeable future. Just not sure exactly what it will look like yet. It's up many builders.
528,2022-06-26 13:07:05+00:00,This would be so much easier if they accepted crypto. Not easy to transfer $1 of fiat money internationally. https://t.co/LHfhO2PZnM
529,2022-06-26 13:05:30+00:00,"🙏 The Guardian

Re: $75 billion, “I actually have no idea how they come up with those numbers. You need to understand that net worth are just estimates. When I look at my wallet, I don’t have anywhere close to any of those numbers.”

https://t.co/2z1cN3FC4i"
530,2022-06-26 13:03:07+00:00,"Allegations against Cyril Ramaphosa may seem trivial compared with those against Jacob Zuma. Nonetheless, they may help the pro-Zuma faction of the ruling African National Congress https://t.co/KQOulCHBZH"
531,2022-06-26 13:02:05+00:00,"As Pet Shop Boys continue their greatest-hits tour, our Back Story columnist muses on their genius—and why their best songs will never get old https://t.co/zdwMoEsVsG"
532,2022-06-26 12:48:03+00:00,Take a tour of the world’s football pitches with these five books: they match the sport with politics and art https://t.co/DI8OtmcYhK
533,2022-06-26 12:43:02+00:00,A survey in 2020 in Brazil showed that only a quarter of teachers had undergone training in how to talk to their pupils about sex https://t.co/KjbOzAgue7
534,2022-06-26 12:43:02+00:00,Do you have thoughts on how we can tailor our content for American audiences? We want to hear from you https://t.co/8mXAARoR60
535,2022-06-26 12:41:02+00:00,"For decades, Erich Korngold’s influential film music eclipsed his concert and operatic works. In recent years that has changed https://t.co/NI2r5ASdnx"
536,2022-06-26 12:35:05+00:00,"The publication of Alaa Abd el-Fattah’s book, which describes torture and police brutality, is itself a major act of defiance https://t.co/q3q8IIOso3"
537,2022-06-26 12:30:08+00:00,"A new book tells the story of the Lazarus Group, state-sponsored hackers who are thought to have netted billions of dollars of precious foreign currency for the North Korean regime https://t.co/5ruE2MzO2d"
538,2022-06-26 12:25:05+00:00,"We’re looking for an audio producer to make our award-winning weekly podcast, “Money Talks”. If you fit the bill, apply by July 1st https://t.co/H4iEr87OL8 https://t.co/7GZH8aCWua"
539,2022-06-26 12:21:03+00:00,"Exactly 74 years after the Empire Windrush arrived with hundreds of Jamaican migrants, Prince William unveiled a state-funded statue in Waterloo railway station https://t.co/636bcOQhM0"
540,2022-06-26 12:19:02+00:00,The ECB has a formidable new problem to solve: working out how to fight inflation and support indebted countries at the same time https://t.co/qwraUsyP0Y
541,2022-06-26 12:17:03+00:00,"The conservative People’s Party’s victory in Andalucía halted the rise of Vox, a hard-right party, in the region https://t.co/3fbXwVeU8F"
542,2022-06-26 12:08:18+00:00,"Food vendors are not a nuisance, argues our food columnist. They reflect the pattern of immigration and evolving tastes in a city https://t.co/zmm58KFWLa"
543,2022-06-26 11:50:04+00:00,The Supreme Court has never before withdrawn a constitutional right that so many Americans have relied upon for so long https://t.co/hUaOm94qXO
544,2022-06-26 11:47:54+00:00,In 1972 Portugal’s dictatorship tried to suppress a book by three feminists. The international backlash was extensive https://t.co/A5mrElLFMO
545,2022-06-26 11:32:21+00:00,Tensions were already running high in the region. Add the status of the Taiwan Strait to the list of things America and China disagree on https://t.co/A2Q8jtqc2j
