,Date,tweet
862,2022-05-13 15:02:52+00:00,All Rand Paul wanted was an inspector general to oversee how the $40 billion to Ukraine would be spent. They rejected it because this entire thing is a giant money laundering scheme funded by American taxpayers to enrich defense contractors and corrupt oligarchs overseas.
863,2022-05-13 14:33:52+00:00,"Interviewed by Italian TV Rai1, Zelensky confirmed that Macron has proposed for Ukraine to give up some territory to Russia in order to present a face-saving option for Putin. 

Zelensky said it’s out of the question.

Macron is the one who needs to save his face after this. https://t.co/snqmtFyH2x"
864,2022-05-13 14:21:32+00:00,A nation that cannot ensure an ample supply of baby formula has no business giving $40 billion to Ukraine.
865,2022-05-13 13:58:07+00:00,NEW - Ukraine's Zelensky will virtually join Klaus Schwab's annual meeting of the World Economic Forum. https://t.co/NMb7ydOFJ7
866,2022-05-13 13:41:16+00:00,"A historic building is on fire in the center of #Irkutsk, #Russia. https://t.co/41de8OXdEa"
867,2022-05-13 13:30:25+00:00,"My dear Indonesians: Ukrainian police, diplomats and volunteers risked their lives to evacuate all 133 Indonesian citizens from Ukraine. All safely reached beloved Nusantara. I believe Ukrainian heroes deserve a word of gratitude. Just say ""thank you""... https://t.co/SsXRXJB43P"
868,2022-05-13 13:25:17+00:00,So today we have learnt that according to @ZelenskyyUa @EmmanuelMacron wanted Ukraine to make consessions and @Bundeskanzler wants a ceasefire. Both beneficial for Russia. Good to know who are your friends and who are not.
869,2022-05-13 13:14:06+00:00,"Good morning. May I show you something truly amazing? Look at what @CoriBush admits about the $40b war package she -- and the entire Squad -- just voted for: ""a large percentage"" goes not to Ukraine but ""to private defense contractors,"" with ""increased risks of direct war."" https://t.co/2R8UmgjUgo"
870,2022-05-13 13:08:20+00:00,"Russia just extended Brittney Griner's detention another 30 days.

Do you think she misses the Star Spangled Banner yet?"
871,2022-05-13 13:06:37+00:00,"But but but.. Ukraine!

Just imagine if the government leaders (who hold power because they were elected by the People) actually legislated and voted to fix the things their voters truly care about.

Gee there’s a novel idea. https://t.co/OJj91BhHki"
872,2022-05-13 13:03:13+00:00,"If Finland and Sweden want to join NATO, we should emphatically support their inclusion.

They will contribute immensely to our collective defense.

And their admission will also make Russia’s war on Ukraine an unmitigated strategic failure."
873,2022-05-13 13:01:11+00:00,"Ron DeSantis wants us to forget, but we're not going to let it happen. $300,000,000 of Florida's pension for our teachers, police officers, and firefighters is invested in Russia.

And DeSantis has decided to keep it there, hoping Russia recovers."
874,2022-05-13 12:58:57+00:00,"Brittney Griner’s detention has been extended 30 days by Russian authorities. Her request for house arrest has also been denied.

Earlier this month, the U.S. State Department classified Griner as “wrongfully detained” by Russia. https://t.co/Bs8JKLl3Iu"
875,2022-05-13 12:45:34+00:00,Why didn't Bernie Sanders block the Ukraine funding bill?
876,2022-05-13 12:19:16+00:00,"💥 
The Russian Defence ministry reported it has captured Pfizer &amp; Moderna bio weapon labs in Ukraine."
877,2022-05-13 12:14:25+00:00,"The Senate is broken.  

90% of Americans support aiding Ukraine. 

1 Senator, Rand Paul, blocked passage of Aid to Ukraine."
878,2022-05-13 12:10:46+00:00,This is exactly what no Western leader must do - offer Putin part of Ukraine's sovereignty to allow him to save face. Some people have no shame. Excellent that Zelensky calls Macron out. https://t.co/sDeTC23mzY
879,2022-05-13 12:02:54+00:00,"💬CinC AF of Ukraine:
Special greetings and thanks from our artillerymen to the American people for the M777 howitzer.
My guys know the price of artillery. First of all, they wanted to convey that this is a high-precision and very effective weapon.
Together to Victory! https://t.co/x5mNB4YEmM"
880,2022-05-13 11:44:53+00:00,"Here's the latest pew research on the top 12 things Americans are concerned about.  Funny, I don't see Ukraine anywhere on that list. https://t.co/uqCYyKu2nU"
881,2022-05-13 11:43:35+00:00,"Three points from my long phone call with #Putin today: 
There must be a ceasefire in #Ukraine as quickly as possible. 
The claim that Nazis are in power there is false. 
And I also reminded him about Russia’s responsibility for the global food situation."
882,2022-05-13 11:35:12+00:00,#Ukraine Another Belarusian defending Ukraine died in the Donetsk region. 34-years-old Kanstantsin Dziubayl was on the frontline since the war started in 2014. https://t.co/MoW4KfbeGu
883,2022-05-13 11:23:39+00:00,"While U.K. tightens sanctions on Putin’s inner circle, imposing sanctions on his mistress and ex-wife, France apparently asked Ukraine to surrender to appease Putin.

Symbolic."
884,2022-05-13 11:06:14+00:00,"Zelensky in an interview with Italian TV Rai1 has confirmed that Macron had proposed him to make concessions to Ukraine's sovereignty in order to come up with a face-saving option for Putin. ""We are not ready to lose territory to save something for somebody"" - added Zelensky"
885,2022-05-13 11:03:33+00:00,"The world would be a much better place if people in positions of power had had the courage to take a stand. 

Unfortunately for Ukraine, leaders of France and Germany are not up for the task."
886,2022-05-13 10:57:01+00:00,"⚡️ Zelensky: Macron offered concessions on Ukraine's sovereignty to help Putin save face.

President Volodymyr Zelensky said that French President Emmanuel Macron’s negotiations were “in vain,” adding that “we don’t want to save something for someone and lose territory for it.”"
887,2022-05-13 10:40:27+00:00,"Putin and his army are not “cornered”. They could leave Ukraine at any time. Putin is a dictator. He does not need to “save face” in front of anyone. He could declare victory and order his troops home today, without any fear of someone or some group seeking to topple him."
888,2022-05-13 10:11:11+00:00,"Great to meet with Norway's PM @jonasgahrstore.

We discussed the urgent need to protect people from rising energy costs and the ambition needed to deliver jobs of the future.

I also thanked the Norwegian people as Europe stands united against Russia's attack on Ukraine. https://t.co/CQ03jwF2Gs"
889,2022-05-13 08:26:05+00:00,"Sen. Rand Paul single-handedly blocked a bill for $39.8 billion of economic, humanitarian and defense aid to Ukraine, delaying a bipartisan push to maintain steady assistance to Kyiv. 

The bill is set to pass next week despite his objection. 

https://t.co/soE34WHAB7"
890,2022-05-13 06:58:22+00:00,"⚡️Truss: Sanctions against Russia should only be lifted after troops leave Ukraine.

Russian President Vladimir Putin must face a defeat that prevents further aggression, UK’s Foreign Secretary Liz Truss said on May 12. “Putin is humiliating himself on the world stage,” she said."
891,2022-05-13 06:01:17+00:00,"They went to war when 🇷🇺Russia invaded 🇺🇦. They believed in Freedom and the right to live in their God-given land
They laid down their lives not only for Ukraine, but for all of Europe! 

RIP - Atanas Ivanov, Vladyslav Bilatchuk (34yrs), Artem Azarov, Andriy Vorona
#ArmUkraineNow https://t.co/yoR3MNA65s"
892,2022-05-13 02:59:05+00:00,Bernie Sanders did not block the 40 billion bill for Ukraine but Rand Paul did. Let that sink in.
893,2022-05-13 02:56:36+00:00,"⚡️CNN: UN official warns Putin millions will die if Ukraine’s ports remain blocked. 

David Beasley, head of the UN World Food Program, told CNN that if Putin does not reopen Ukraine’s Black Sea ports, it could cause a global hunger crisis and the collapse of Ukraine’s economy."
894,2022-05-13 02:45:32+00:00,"Kremlin propagandists are very pleased with Tulsi Gabbard's ""excellent speech"" on Tucker Carlson's show, since Tulsi is helping the Kremlin to rattle its nuclear weapons⁠—which is frankly the only fear factor at its disposal to deter the world from helping Ukraine defend itself. https://t.co/aXYW2gP0nm"
895,2022-05-13 02:00:04+00:00,"Senator Rand Paul of Kentucky on Thursday single-handedly delayed a bipartisan effort to quickly send $40 billion in aid to Ukraine, which Congress had tried to fast-track amid the escalating brutality of Russia’s war.
https://t.co/R6ndCo1NKh"
896,2022-05-13 01:53:42+00:00,"Wait- Republicans refuse to vote for infrastructure, healthcare, childcare, universal pre-k, lower prescription drug prices, social security, Medicare, Medicaid &amp; lower taxes, but they won’t help Ukraine because they’re too busy “helping Americans first”?

Yeah… fuck that."
897,2022-05-13 01:41:50+00:00,"Senator Rand Paul has halted the Senate vote on sending $40 Billion to Ukraine. He wants language in the Bill that includes an Inspector General look at this spending.

The Dems and RINO McConnell are furious.."
898,2022-05-13 01:39:55+00:00,"Personally, I think it would do a lot for Rand Paul’s image if he went to fight on the front lines in Ukraine now. Don’t you think? I think he should do it."
899,2022-05-13 01:16:17+00:00,"August 8, 2018: Rand Paul hand delivers a letter from Trump to Putin

May 12, 2022: Rand Paul blocks quick passage of a bill to provide Ukraine nearly $40 billion more in aid."
900,2022-05-13 00:48:00+00:00,"Good thing Rand Paul, who just single handedly blocked an aid package for Ukraine, is up for re-election in 6 months.  

I’m old enough to remember when he was chosen to go to Moscow and deliver a letter from Trump."
901,2022-05-13 00:43:14+00:00,"While I sympathize with the people of Ukraine, and commend their fight against Putin, we cannot continue to spend money we don’t have. Passing this bill brings the total we’ve sent to Ukraine to nearly $54 billion over the course of two months."
902,2022-05-13 00:40:49+00:00,".@AOC, what is the carbon footprint of the proxy war with Russia you voted to fund?"
903,2022-05-13 00:38:03+00:00,The American political story of this century is the story of how Russia infiltrated the Republican Party.
904,2022-05-13 00:22:33+00:00,"The fact that Rand Paul can stop the $40 billion to Ukraine, just by asking what it will be used for, is proof we probably shouldn't be sending it."
905,2022-05-13 00:07:06+00:00,Rand Paul single-handedly delays Senate approval of $40B Ukraine aid package. https://t.co/ymFfNomDhB
906,2022-05-12 23:56:45+00:00,Kentucky Republican Sen. Rand Paul has delayed until next week Senate approval of an additional $40 billion to help Ukraine and its allies withstand Russia’s invasion. Paul said he wants the spending to be scrutinized. https://t.co/BnLdlwLFlL
907,2022-05-12 23:41:34+00:00,"If you are voting against aid for Ukraine, or you excuse away Putin’s murderous aggression, it might be a small tip off to what you really think of freedom and democracy."
908,2022-05-12 23:31:36+00:00,@elonmusk I see a lot of Ukraine flags disagreeing with me. Thank you for supporting a country that has strict abortion laws. ✊
909,2022-05-12 23:29:27+00:00,"On behalf of America and Ukraine, I'd like to say FUCK RAND PAUL."
910,2022-05-12 23:17:19+00:00,"BREAKING NEWS: Rand Paul is the ONLY senator that BLOCKED a $40 billion aid bill for Ukraine from passing. 

What do you say to him?"
911,2022-05-12 23:02:22+00:00,"Rand Paul just single-handedly blocked sending additional money in critical military aid to Ukraine.

So my question is: is he a Russian asset, an evil asshole, or both?"
912,2022-05-12 22:45:33+00:00,"Leftists were outraged about Elon Musk spending $44 billion to buy Twitter and not using that money for their socialist demands.

But they have no problem spending $40 billion of your tax dollars on more aid for Ukraine with little direction on where that money will actually go."
913,2022-05-12 22:37:34+00:00,"* Kentucky Senator Rand Paul blocks swift passage of $40B in aid to Ukraine
* Kentucky teacher pension fund was the 2nd largest investor in a Russian Bank
* Kentucky mill project received $200M from a Russian company previously under US Sanctions
* Anyone think something is up?"
914,2022-05-12 22:34:16+00:00,"John McCain WARNED us about Rand Paul when he said ""The Senator from Kentucky is NOW working for Vladimir Putin.""

Senator Paul voting today to BLOCK $40 Billion to aid Ukraine is UNFATHOMABLE!

https://t.co/Niz2HUbQXC"
915,2022-05-12 22:22:36+00:00,"Republicans: “The government needs to stop helping Ukraine and start helping Americans!”

Also Republicans: votes against lower prescription drug costs, universal pre-K, affordable child care, clean energy independence, roads &amp; bridges, paid leave, lower health care premiums..."
916,2022-05-12 21:58:16+00:00,"The top Democrat and Republican in the U.S. Senate joined forces in a rare moment of unity on Thursday in an attempt to pass $40 billion in aid for Ukraine, only to be stymied by a single Republican lawmaker: Sen. Rand Paul.https://t.co/ln2wdmiUeS"
917,2022-05-12 21:46:16+00:00,Congress is sending $40 billion to Ukraine and $0 to homeless American veterans.
918,2022-05-12 21:25:51+00:00,"Since Rand Paul (R-Moscow) just unilaterally prevented a critical aid package for Ukraine from passing, a reminder that the last actual Republican, John McCain, said “The senator from Kentucky is now working for Vladimir Putin.”"
919,2022-05-12 21:22:36+00:00,"Rand Paul just single-handedly blocked passage of aid to Ukraine, despite every other senator allowing it to pass. In case you needed more evidence of how broken the Senate is."
920,2022-05-12 21:17:29+00:00,JUST IN: Sen. Rand Paul BLOCKS $40B Ukraine Aid Package https://t.co/SwF7Zdnt4u
921,2022-05-12 21:11:26+00:00,"Great news that Sweden and Finland are going to become NATO members. Once the war is over, Ukraine should join too. Yes, sounds ambitious now. But we in Ukraine dream big"
922,2022-05-12 21:10:33+00:00,"Marge loses her cool again today, telling the reporter than he doesn’t care about Americans because he asked a question about Ukraine. https://t.co/ZhveGV3rQB"
923,2022-05-12 21:00:03+00:00,Kentucky Sen. Rand Paul has blocked quick passage of a bill to provide Ukraine nearly $40 billion more in aid https://t.co/ZhVN2uF7aY
924,2022-05-12 20:59:36+00:00,"Some of us had the courage to call out the Ukraine nonsense for exactly what it was from the very beginning: a money laundering operation, with a bad faith actor (Zelensky) being propped up by the media to garner our consent to being robbed by our government, yet again. https://t.co/gR8jVBCdpP"
925,2022-05-12 20:56:00+00:00,Rand Paul just blocked critically needed aid to Ukraine.
926,2022-05-12 20:51:16+00:00,"#Kentucky Senator Rand Paul blocked a bill to allocate additional aid to #Ukraine in the record amount of almost $40 billion: he opposed the adoption of the bill in the current wording.

Because of him, the decision on aid to Ukraine is postponed at least until next week. https://t.co/vENV25vgLX"
927,2022-05-12 20:44:13+00:00,The US Senate has been forced to postpone final passage of $40 billion Ukraine aid package after Republican Rand Paul objected to the vote https://t.co/fsEzzM6G6B
928,2022-05-12 20:44:12+00:00,"Am I the only thinking that Trump made a plan with Putin to weaken NATO so Russia could easily take over Ukraine and possibly some other countries?!
#DemVoice1"
929,2022-05-12 20:39:18+00:00,#BREAKING: Rand Paul objection delays $40 billion Ukraine aid package https://t.co/EFwRYZIM6q https://t.co/TJzl6ZzyMo
930,2022-05-12 20:39:04+00:00,NEW 🚨 GOP Sen. Rand Paul blocks quick passage of $40 billion Ukraine aid
931,2022-05-12 20:36:33+00:00,"Senator Rand Paul is blocking the passage of a $40 billion aid bill for Ukraine.

Rand Paul is a piece of shit."
932,2022-05-12 20:35:49+00:00,Republican Rand Paul is blocking quick passage of a $40 billion aid bill for Ukraine.
933,2022-05-12 20:34:11+00:00,"Senator @RandPaul Objects To Passage Of $40 Billion Foreign Aid Package To Ukraine Until Financial Oversight Is Included

""My oath of office is to the U.S. Constitution, not to any foreign nation.""

Schumer Refuses To Modify, Paul Objects https://t.co/HnxUxPCFge"
934,2022-05-12 20:30:01+00:00,"⚡️Russian official threatens military attacks against Finland, Sweden. 

Dmitry Polyansky, a deputy representative of Russia at the United Nations, said that Sweden and Finland joining NATO would turn them into enemy countries."
935,2022-05-12 20:25:42+00:00,I'm worried the Military-Industrial Complex doesn't want an end to the Ukraine conflict. https://t.co/uJXeGHlzOS
936,2022-05-12 20:22:19+00:00,Kentucky Sen. Rand Paul has blocked quick passage of a bill to provide Ukraine nearly $40 billion more in aid https://t.co/3t03brKj8Y
937,2022-05-12 20:14:05+00:00,".@RandPaul: ""My oath of office is to the U.S. Constitution, not to any foreign nation … We cannot save Ukraine by dooming the U.S. economy.” https://t.co/aRqY3DwZyU"
938,2022-05-12 20:07:31+00:00,"⚡️ Russia announces it has kidnapped 190,000 Ukrainian children https://t.co/aJ8pomjxgQ"
939,2022-05-12 20:05:23+00:00,"💬 Russia's Presidential Commissioner for Children’s Rights Maria Lvova-Belova: More than 190,000 children had arrived in Russia from Donbass by early May, including about 1,200 coming from orphanages in the Donetsk and Lugansk People’s Republics.

🔗 https://t.co/785sa8QGsc https://t.co/jG7lVg03hm"
940,2022-05-12 20:03:11+00:00,SEN. RAND PAUL: “We cannot save Ukraine by dooming the US economy.”
941,2022-05-12 19:51:11+00:00,Sen. Rand Paul (R-KY) calls $40 billion military aid package to Ukraine “a gift” and blocks it from passing. https://t.co/Lxfez8LApb
942,2022-05-12 19:41:47+00:00,"GOP KY Sen Paul objects to Schumer, blocking Senate passage of Ukraine aid bill"
943,2022-05-12 19:41:02+00:00,"! Rand Paul just unilaterally blocked swift passage of Ukraine aid. He wanted the rest of the Senate add language to the bill he plans to vote against anyway bc debt/inflation.

He has this power because the Senate runs on *unanimous consent*, not nearly unanimous consent."
944,2022-05-12 19:06:49+00:00,"""The Squad"" just voted to send another $40 Billion of weapons to the Ukraine proxy war, some of which will end up in the hands of Nazis. So what exactly is ""The Squad"" a squad of? Because it's clearly not left-wingers or anti-imperialists."
945,2022-05-12 18:55:36+00:00,"Seems odd to blame inflation on the war in Ukraine when it was already  7.9% when Putin invaded. No mention of money printing. Our rulers are lying to us that is clear, but to what end?"
946,2022-05-12 18:03:07+00:00,"Russia's Deputy UN Ambassador Dmitry Polyanskiy threatens Sweden and Finland: 

""As soon as Finland and Sweden become members of NATO and military units of the alliance are there, these territories will become a possible target for the Russian military"""
947,2022-05-12 17:38:20+00:00,"FYI Trump surrogates (including Donald Trump Jr.) are online today pushing for Republicans to oppose more defense funding for Ukraine. 

Just further confirmation which side Trump is on."
948,2022-05-12 17:32:43+00:00,"A Trucker just emailed @dbongino and he says the reason for the shortage of baby formula is that Truckloads of it are being shipped to Ukraine and the border 

THIS IS TREASON ✔️ IMPEACH BIDEN"
949,2022-05-12 17:32:08+00:00,"What amazes me is the amount of understanding @RandPaul brings for Putin, but not for defending #Ukraine’s liberty. Liberty - does it ring a bell? You sure you’re “libertarian conservative” &amp; not putinterian conservative?
#StandWithUkraine #ArmUkraineNow

https://t.co/vqss9TCQJI"
950,2022-05-12 17:02:26+00:00,"Remember when democrats and RINOs nickel and dimed President Trump on wall funding? They all said ""oh no, heaven forbid, we can't afford $8 billion. Maybe we will give you $2 billion."" But Ukraine? Open the money spigot! It's always America Last with these clowns."
951,2022-05-12 17:00:06+00:00,Rand Paul Is Holding Up $40 Billion In Aid To Ukraine https://t.co/2R5YZSTheB
952,2022-05-12 16:55:56+00:00,"Finland:

►It imports all its natural gas from Russia.

►6% of its electrical energy comes from natural gas.

►It has no other supplier of natural gas, and no means to receive liquified gas.

►21% of its electricity is produced by oil.

►100% of its oil comes from Russia."
953,2022-05-12 16:40:59+00:00,"#Opinion

A French national, who spent several weeks in Ukraine with humanitarian mission, interacted with Neo-Nazis, speaks the #truth about what is happening there - facts that the mainstream media and Western politicians continue to ignore.

#See4Yourself &amp; #Think4Yourself https://t.co/cbXJbL7u0K"
954,2022-05-12 16:34:27+00:00,"British soldiers will fight Russia if it invades Sweden or Finland says Prime Minister Boris Johnson

DO PEOPLE AGREE WITH THIS? 

 https://t.co/BHlLS4YMWo"
955,2022-05-12 16:26:29+00:00,"Three Chinese banks have already rejected Russia's requests to start a new payment system, analysts believe China wants Russia to be heavily damaged so as to devour it"
956,2022-05-12 16:22:05+00:00,"I've avoided the term, but ""Fraud Squad"" feels pretty apt. Challenging the military industrial complex is leftism 101. The Squad just voted to give it another $40 billion via the Ukraine proxy war. So, insofar as they claim to be a leftist contingent, how are they not a fraud?"
957,2022-05-12 16:21:24+00:00,"No new spending!  

Covid slush fund.  Ukraine slush fund.  America is broke and they’re pushing us over the cliff.  “US House Speaker Pelosi plans to request $22.5B in COVID-19 funding to begin negotiations.” 
Republicans answer should be ZERO. Period."
958,2022-05-12 16:02:11+00:00,"Dear @NATO, if Finland is eligible for fast-tracked membership, why wasn’t Ukraine? Aren’t both countries on Russia’s borders? (Asking for a friend.)"
959,2022-05-12 15:51:21+00:00,This shirt is a gift from the locals here. Rocking this on my first day back. Just not a big fan of red. All jokes aside these people are amazingly grateful for everything you guys have done. It’s honestly going to be hard to leave. Ukraine is my new family. https://t.co/8ef3k3ImQF
960,2022-05-12 15:26:05+00:00,"⚡️Media: Russia may cut off gas supply to Finland on May 13.

Key Finnish politicians have been warned that Russia may cut off the gas supply to Finland on May 13 due to the country’s potential accession to NATO, Finland’s media outlet Iltalehti reports citing anonymous sources."
961,2022-05-12 14:25:25+00:00,"Sam Coates - What's your response to allegations in the New York Times that the Conservative Party took donations from a donor with links to Russia &amp; money linked to a Russian bank account? 

Boris Johnson - You've got to be from the UK to give donations https://t.co/DGVhHJ8gwg"
962,2022-05-12 13:26:37+00:00,"A tally of Russian losses from the infamous failed Russian Siverskyi Donets river crossing near Bilohorivka.
In total 73 Russian equipment were destroyed/abandoned, including a BTG worth of AFVs.

Great thanks to J.P. for counting and sending it to me.

1/2
#Russia #Ukraine https://t.co/FyKtPogG8Z"
963,2022-05-12 13:26:22+00:00,MAGA world after some early vacillation seems to have made up its mind it will follow Tucker Carlson/Glenn Greenwald to oppose US aid to Ukraine and favor a pro-Russia resolution of the invasion.
964,2022-05-12 13:11:44+00:00,BREAKING: Siemens announces its complete withdrawal from Russia
965,2022-05-12 12:33:51+00:00,"Finland said it would apply to join NATO 'without delay,' with Sweden expected to follow suit, suggesting Russia's invasion of Ukraine will bring about the very expansion of the Western military alliance that Vladimir Putin aimed to prevent https://t.co/Orl7oglNae 1/5 https://t.co/9peSJmFWZb"
966,2022-05-12 12:04:54+00:00,"Ukraine is the world’s granary. By hampering vital exports, the Kremlin’s war is threatening food security worldwide.

Today we take action to ease transport of cereals from Ukraine &amp; tackle urgent bottlenecks.

We will soon better connect 🇪🇺🇺🇦 with the Connecting Europe Facility"
967,2022-05-12 11:49:26+00:00,"Congress has spent almost $500 per US family to support the war in Ukraine.

The money isn’t being borrowed, it’s being printed, and the result will be more inflation.

Wages can’t be increased enough to make up the difference because the money and goods are leaving our country."
968,2022-05-12 11:16:10+00:00,"Captain Dmitry Pak was a graduate of the Novosibirsk Higher Military Command School and served in a spetsnaz unit. He was killed in Ukraine on May 6. He took part in the Annexation of Crimea and deployed to Syria and Libya.
https://t.co/DtEGl5eUQK
https://t.co/MMQIBNx1ed https://t.co/rHhn7aS2zW"
969,2022-05-12 11:10:54+00:00,"#BREAKING #Russia threatens with ""military measures"" to ""eliminate the threats"" posed by Sweden and Finland's accession to #NATO"
970,2022-05-12 11:00:38+00:00,Kremlin says Finland joining NATO is definite threat to Russia https://t.co/IR7GSssCKd https://t.co/jCYH5kkPLs
971,2022-05-12 10:19:27+00:00,"⚡️ Russia's Dmitry Medvedev threatens NATO with nuclear war over helping Ukraine. 

Medvedev, deputy chairman of the security council, said that NATO sending weapons, training Ukrainians ""increases the likelihood of a direct and open conflict between NATO and Russia."""
972,2022-05-12 09:55:12+00:00,BREAKING: Russia says Finland joining NATO would represent a threat to Moscow
