,Date,tweet
427,2022-05-21 07:54:08+00:00,"@JanJekielek @Shem_Infinite @EpochTimes @themarketswork @JasperFakkert Confusing-gate, more like it!

Bottom line: A prominent lawyer working for the Clinton campaign fabricated Russia-Trump collusion using a retired MI6 spy &amp; some actual Russians. This is not ok!

There may have been actual Russian interference, but still the above is not cool."
428,2022-05-21 07:27:09+00:00,Russia continues to be hit by random accidents. https://t.co/vwgVeREj5A
429,2022-05-21 06:00:55+00:00,"President Zelensky last night proposed a deal with allies to compensate Ukrainians who’ve suffered from Putin’s invasion by seizing Russian funds and assets abroad. “Russia will feel the true weight of every missile, every bomb…it has fired at us.” https://t.co/2v6OlQcV4t"
430,2022-05-21 05:49:35+00:00,"Hey Professor, Ukrainian warriors are kicking your ass in Ukraine right now. You really want to now go to war with the largest military alliance in the world anchored by the most powerful military in the world? Really? https://t.co/GCF2YypsaL"
431,2022-05-21 05:24:08+00:00,BREAKING: Russia has stopped supply of natural gas to Finland
432,2022-05-21 02:47:06+00:00,"The Ukrainian government is quickly learning that it can say anything, literally anything about Russia, without any evidence at all, and the western mainstream press will report it as an actual news story. https://t.co/BYESIPwe1x"
433,2022-05-21 02:18:53+00:00,BREAKING: Russian prank call duo trick George W Bush into talking about Ukraine biolabs https://t.co/52iaN6YvBm
434,2022-05-21 02:14:38+00:00,"GAME CHANGER: The US announced that it's sending MIM-104 Patriot anti-air missile systems to Ukraine.   Patriot batteries can intercept aircraft &amp; ballistic missiles at ranges &gt; 31 miles (50 km) and altitudes up to 79,000 ft (24,000 meters).
https://t.co/M8ShB55ufN https://t.co/tCkO102tgr"
435,2022-05-21 01:36:02+00:00,"Everything they told you about Trump, Russia, Hillary, and the 2016 election was a lie. All of it."
436,2022-05-20 23:44:31+00:00,@CNN Finish the statement @CNN . Hillary approved the plans to share the information with a reporter so they WOULD INVESTIGATE IT. It’s not like she asked Russia to get Trump’s emails.
437,2022-05-20 23:17:50+00:00,"⚡ The day has come: Mariupol and the Azovstal' steel plant are completely liberated by the Allied Forces of Russia, DPR &amp; LPR. 

The last group of the Azov battalion Neo-Nazis and Ukrainian servicemen surrendered - over 2400 militants laid down arms. https://t.co/KWuhzAub7r"
438,2022-05-20 23:05:24+00:00,"Why isn’t every Republican calling for Hillary Clinton to be charged with treason now that we know she authorized the entire Russia hoax?

🤔"
439,2022-05-20 22:59:14+00:00,"Doesn’t get said enough:

1. Thank you @POTUS for having the guts to get us out of Afghanistan &amp; end America’s longest war. Leaving was always gonna be ugly, but u held firm.

2. Thank you @POTUS for uniting the free world against Putin &amp; for strongly &amp; smartly defending Ukraine."
440,2022-05-20 22:44:39+00:00,"Russia is losing this war. I know no serious military analyst with experience in the region who believes otherwise. Moreover, it now seems possible Ukraine may liberate the territories seized since February &amp; look to free the territories occupied since 2014."
441,2022-05-20 22:43:30+00:00,BREAKING: Germany to deliver fifteen tanks to Ukraine in July
442,2022-05-20 21:18:04+00:00,"A hostage video from Kherson. A Ukrainian woman with swollen eyes and shaven head is forced to say on camera that she has undergone 'a denazification course', apologize to Russians. It's hard to imagine what was done to her. All proponents of Ukraine's concessions should watch it https://t.co/09Ds6qfagG"
443,2022-05-20 21:12:26+00:00,Elon Musk is now spreading treasonous lies about Hillary Clinton — and claiming the Trump-Russia collusion was a “hoax.” Elon is also kissing up to Jim Jordan — an guy who allowed 43 kids at OSU to be molested. I’ll never buy a Tesla. For as long as I live. Neither should you.
444,2022-05-20 20:42:08+00:00,"Hillary Clinton personally approved leaking the Trump-Russia hoax. 

There’s only one way for justice to be served: https://t.co/OhZcn0c3HN"
445,2022-05-20 20:18:30+00:00,"Canada supports Ukraine’s application against Russia before the International Court of Justice. We have been very clear: We stand with Ukraine, and with the brave women and men who are fighting to defend its sovereignty and territorial integrity. https://t.co/Vr1mr15ejm https://t.co/psp0vXnptZ"
446,2022-05-20 20:15:04+00:00,"We are planning to publish a series of articles where we will cover types of weapons which were donated to Ukraine as foreign military aid - much of which is missing coverage.

Would our followers be interested? Quite different to our usual content!"
447,2022-05-20 20:11:32+00:00,"🚨 The world has just ten weeks' worth of wheat left after Ukraine war

Food supplies are being rocked by Russia's invasion of the 'breadbasket of Europe' 🧵👇
https://t.co/ar8F6hPhfs https://t.co/OxZU6QplyR"
448,2022-05-20 20:10:18+00:00,"⚡️ Zelensky: Western partners involved in evacuation of Mariupol defenders.

Although the details were not disclosed, President Volodymyr Zelensky said that Ukraine was negotiating the evacuation with the leaders of several countries, including Turkey, Switzerland and Israel."
449,2022-05-20 20:03:02+00:00,"@truth_tesla @veespike @HillaryClinton @Twitter Whether other senior campaign managers were aware or not is a separate question.

What is *not* in question is that Sussmann charged the Clinton Campaign for his Russia hoax meeting with the FBI.

Source document:
https://t.co/61C8L9isIU"
450,2022-05-20 20:01:05+00:00,"Hillary Clinton personally approved plan to share Trump-Russia allegation with the press in 2016, campaign manager says https://t.co/UcUdOkA34w"
451,2022-05-20 19:52:28+00:00,Hillary Clinton and Jake Sullivan knew the Trump-Russia collusion dossier was false but pretended to play dumb with the American people. https://t.co/61HDAs5W1z
452,2022-05-20 19:49:46+00:00,"Unspeakable crimes are being reported from liberated regions in Ukraine. Sexual violence as weapon of war against women &amp; children among atrocities committed by Russian troops. Perpetrators must be held accountable.

EU works globally to eliminate conflict-related sexual violence"
453,2022-05-20 19:25:59+00:00,"#Ukraine: The famous Ukrainian Journalist Yuriy Butusov says that he and Ukrainian soldiers, while on reconnaissance, stole a Russian BMP-1 from a Captain Dmitry Furdui of the Russian 35th Separate Guards Motor Rifle Brigade, just 100m from enemy positions. https://t.co/4cMmAW1aNK"
454,2022-05-20 19:25:19+00:00,"@truth_tesla @veespike @HillaryClinton @Twitter ??

Sussmann himself admitted billing Clinton Campaign to pay for him to present Russia hoax to FBI! This is not even questioned by the defense.

Btw, I donated to &amp; voted for Hillary, so am doubly pissed off about those funds being used for lying.

https://t.co/PtFgYzpXQN"
455,2022-05-20 18:44:12+00:00,"BREAKING: Hillary Clinton, during the 2016 presidential campaign, ""agreed"" to leak alleged secret communications between Donald Trump and Russia's Alfa Bank to the media, according to Clinton's former campaign manager, Robby Mook. https://t.co/6y3RD4C5fd https://t.co/BzXGeaZSUS"
456,2022-05-20 18:42:53+00:00,"BREAKING: Hillary Clinton authorized dissemination of Russia collusion hoax to press
https://t.co/ak78fmXmBv"
457,2022-05-20 18:39:14+00:00,LOCK HER UP: Hillary Clinton Personally Approved Sharing Trump-Russia Story With the Press https://t.co/OkfAitYL7s
458,2022-05-20 18:36:26+00:00,"@Jim_Jordan All true. 

Bet most people still don’t know that a Clinton campaign lawyer, using campaign funds, created an elaborate hoax about Trump and Russia. 

Makes you wonder what else is fake. 

 https://t.co/avtjEdthmA"
459,2022-05-20 18:35:00+00:00,"I spoke with President Emmanuel Macron of France today. We discussed Russia’s invasion of Ukraine, global food security, and combatting the epidemic of hate we see around the world. @POTUS and I look forward to continuing to work closely with France."
460,2022-05-20 18:28:57+00:00,The world still doesn't understand Ukraine or Ukrainians. Many people here are so filled with hatred towards Russia that they are willing to live on buckwheat for years if that's what it takes to beat Russia. https://t.co/IgqtpvoPmS
461,2022-05-20 18:25:42+00:00,"Hillary PERSONALLY approved leaking baseless Russia collusion claims that her own campaign doubted were true. 

She must testify immediately!
https://t.co/deZkgqlitY"
462,2022-05-20 18:17:18+00:00,"🚨 BREAKING NEWS 🚨

Former Clinton campaign manager testifies that Hillary Clinton personally approved providing one of the Trump-Russia stories (Alfa Bank) to the press. https://t.co/xZCoBw69PF"
463,2022-05-20 17:49:33+00:00,"⚡️Defense Intelligence: Putin is in absolute dead end, he can't stop war, he can't win it.

Kyrylo Budanov, chief of Ukraine’s Intelligence Directorate, told the WSJ that he was “amazed by Russian stupidity” because, according to him, Putin chose the worst option in terms of war."
464,2022-05-20 17:35:02+00:00,"Less than two months ago Biden said his sanctions against Russia would “reduce the Ruble to rubble”.  

Today the Ruble is at its strongest versus the Euro since 2016.

Today the Ruble is at its strongest versus the Dollar since 2018."
465,2022-05-20 17:18:01+00:00,So Hillary Clinton’s campaign manager just testified that Hillary approved sharing the fake Trump/Russia collusion bank claims with the media…#LockHerUp
466,2022-05-20 17:04:34+00:00,How will Ukraine pay back $40 billion?
467,2022-05-20 16:57:05+00:00,"Amazingly, the appeasers, Macron, Scholz, Dragi &amp; NYTimes, want to force Ukraine to give up land to Russia, while more than 90% of the Ukrainians want to fight to win &amp; kick out the Russians from Ukraine. What moral right do these people have to state this drivel?"
468,2022-05-20 16:52:36+00:00,Breaking: Witness in big Durham trial testifies Hillary directly authorized release of fake Russia smears to try to destroy Donald Trump.
469,2022-05-20 16:45:46+00:00,"🚨 🚨🚨BOMBSHELL: Hillary personally approved dissemination of Trump-Russia Hoax to the media, Clinton campaign manager testifies to John Durham https://t.co/37Gs8IHE2A"
470,2022-05-20 16:38:42+00:00,It would be nice if @SpeakerPelosi were to respect the territorial integrity of the United Kingdom in the same way she (rightly) does for Ukraine.
471,2022-05-20 16:36:57+00:00,Biden admin sends another $100 million to Ukraine on top of $40 billion aid package. https://t.co/jXfKkkLjWm
472,2022-05-20 16:29:01+00:00,"⚡️Russian missile hits Odesa Oblast. 

According to Ukraine’s Southern Operational Command, a beach toilet was destroyed due to the attack, and no casualties were reported."
473,2022-05-20 16:05:43+00:00,"⚡️Germany to send 15 anti-aircraft guns to Ukraine in July. 

A German Defense Ministry spokesperson said on May 20 that Ukraine will receive 15 Gepard self-propelled anti-aircraft guns, as well as 60,000 rounds of ammunition, from Germany in July."
474,2022-05-20 15:48:49+00:00,"NEW: @RobbyMook testifies @HillaryClinton herself approved the dissemination of  info alleging a covert communications channel between the #Trump Organization &amp; #Russia's #AlfaBank to the media, despite camp. officials not being ""totally confident""in its legitimacy #SussmannTrial"
475,2022-05-20 15:42:50+00:00,"""Putin is alone, and it seems to me that the most important thing is to keep the sanctions in place until Ukraine wins, reparations are paid and war criminals are tried, which will lead to an inevitable regime change."""
476,2022-05-20 14:49:37+00:00,"Whatever your views on Ukraine, the war and the US role: it's just amazing that the Western press -- which spent a full decade in unison calling the Azov Battalion  neo-Nazi fanatics -- now speak of them in admiring terms and will only say that their Nazism is a ""Russian claim."" https://t.co/izx0ssgdyg"
477,2022-05-20 14:21:14+00:00,BREAKING: Germany will deliver the first 15 Gepard tanks to Ukraine in July
478,2022-05-20 14:12:27+00:00,"In a very short time, America would dominate the world’s economy and cripple our enemies ability to wage war against other countries.

Russia would be broke.

China’s fake fragile economy would fail.

And hard working Americans would be wealthy, successful, &amp; happy.

2/2"
479,2022-05-20 13:49:13+00:00,"NYT, following German “intellectuals” and French President Emmanuel Macron, are now proposing territorial concessions to Putin’s Russia to stop the war.

I agree, give him Alaska."
480,2022-05-20 12:51:34+00:00,Is Turkey Russia’s secret weapon inside NATO?  https://t.co/rciKUlOlPX
481,2022-05-20 12:47:54+00:00,"The plan includes a ceasefire and the demilitarization of the frontline under UN supervision, negotiations on the status of Ukraine vis-a-vis NATO and the EU, a Ukrainian-Russian agreement on Crimea and the Donbas, and a multilateral agreement on peace and security in Europe."
482,2022-05-20 12:47:53+00:00,"⚡️Ukraine confirms Italy proposed plan to end war.

Oleh Nikolenko, a spokesman for Ukraine’s Foreign Ministry, said that Italy’s proposals are now being studied."
483,2022-05-20 12:23:04+00:00,"42 states took Ukraine’s side in the case against Russia at the International Court of Justice and intend to join the proceedings. Grateful to partners who chose the right side of history. The side of truth, international law, and justice. Together, we'll hold Russia accountable."
484,2022-05-20 12:21:47+00:00,Occasional reminder that the entire purpose of the US-Saudi alliance is that in the event of a geopolitical crisis with Russia they are supposed to pump extra oil and stabilize prices but they’re just … not doing it.
485,2022-05-20 11:24:55+00:00,"I've never tried #followbackfriday before but heck why not! I'm a socialist, pro EU, lover not a fighter, stand with Ukraine and despise our current government with every fibre of my being. I'm rubbish at tweeting but I'll definitely retweet you."
486,2022-05-20 10:49:13+00:00,"The New York Times editorial page endorses pressuring Ukraine to cede territory to Russia. Really shameful, guys. https://t.co/8KN4eUfzjQ"
487,2022-05-20 10:23:36+00:00,"As the American people struggle with rising gas prices &amp; inflation, the permanent Washington establishment rushed to send $40B to Ukraine w/o defining what “winning” is &amp; how this ends. They'd rather serve the interests of the military industrial complex than the American people."
488,2022-05-20 10:18:49+00:00,"⚡️Ambassador has impression that Scholz doesn’t want to supply heavy weapons to Ukraine.

Andriy Melnyk, Ukraine’s ambassador to Germany, told RND that Scholz is likely “stalling for time,” waiting for a ceasefire in Ukraine when there is no need ""for courageous decisions.”"
489,2022-05-20 09:55:05+00:00,Is Turkey Russia’s secret weapon inside NATO? https://t.co/tIVa2QfRdG
490,2022-05-20 08:56:00+00:00,"Today, we disbursed a new tranche of €600 million in Macro-Financial Assistance to Ukraine

More is coming - we proposed an additional €9 billion loan for 🇺🇦 in 2022.

Beyond relief, we'll work on a reconstruction platform to help rebuild Ukraine as a free, democratic country. https://t.co/zoZtzvEg7U"
491,2022-05-20 06:55:47+00:00,"Took Imported FM many stumbles &amp; mumbles to admit IK Russia visit was correct. One giveaway was his saying ""it was part of his (IK's) foreign policy"" - almost identical words used in cipher! Raises some conspiracy linkage issues! #امپورٹڈ__حکومت___نامنظور https://t.co/vhQKhKKhme"
492,2022-05-20 06:02:40+00:00,"#Opinion by Maria Zakharova

💬 There is no national consensus behind Stockholm’s decision to join #NATO. 

The Swedish media conveniently did NOT publish any opinion polls in the run-up to the “historic decision”, either.

🔗https://t.co/LEky0AWHKD https://t.co/W0fEPCiUbk"
493,2022-05-20 05:49:18+00:00,Now Imported FM admits IK visit to Russia correct; IK exposed Modi's Hindutva fascist policies in IIOJK; raised a strong voice against Islamophobia &amp; his initiative led to UNGA Res recognising Islamophobia &amp; declaring 15 March every yr as Anti Islamophobia Day.
494,2022-05-20 04:58:11+00:00,"When President Trump wanted to spend $25 billion to build a wall to protect America, Democrats said no.

Now that Ukraine needs to protect it’s borders, Congress sends them $40 billion. 

America First!"
495,2022-05-20 04:54:13+00:00,"So if Finland joins NATO, young Americans are on the hook to die protecting its 830 mile border with Russia, per article 5. 

How about Finland sending some troops to defend OUR border?"
496,2022-05-20 04:10:55+00:00,"Finland is 100% dependent on Russian gas. 

Russia likely to cut off gas supply today.

Absolutely no problem for us, bc gas only ~5% of energy portfolio.

Easy to divert to alternative energy sources and grids.

This is what we call being prepared for different scenarios."
497,2022-05-20 00:22:24+00:00,"⚡️Russia refuses to allow grain shipments from Ukraine, ignores pleas to end Black Sea blockade.

Russia's UN Ambassador Vasily Nebenzya told the UN Security Council Western sanctions against Russia and other factors are to blame for the rise in food prices, not Russia’s war."
498,2022-05-20 00:12:22+00:00,"Nah. ⁦@RandPaul⁩ is 100% right. America gets it too, especially when they figure out where it’s really all going. Our tax payer money should be invested in America. Not Ukraine &amp; not given to Big War! #AmericaFirst  https://t.co/Z6j3UnGZUT"
499,2022-05-19 23:41:20+00:00,There is pretty much no one you can vote for if you think the US should just stay the hell out of Ukraine. A very simple and intuitive position -- but has virtually zero representation anywhere
500,2022-05-19 23:36:02+00:00,"The Biden administration is considering a prisoner swap that would free Brittney Griner from detention in Russia in exchange for notorious illegal arms dealer Viktor Bout, according to sources and Russian media. https://t.co/plJDCSoOaX"
501,2022-05-19 23:18:13+00:00,"Today, I signed the bill delivering $40 billion to #SupportUkraine – a victory for Democracy in the world. 

This assistance will make an immediate and substantial difference in Ukraine’s fight to defend its people, its sovereignty and its nation. https://t.co/RLnW9VJyPu"
502,2022-05-19 23:11:23+00:00,How tf is Ukraine in the World Cup I thought them niggas was busy
503,2022-05-19 22:59:41+00:00,"Bernie &amp; The Squad voting for another $40 Billion to Ukraine is shameful. We should not be spending $100 million dollars a day on a proxy war when Americans continue being evicted, killed by lack of healthcare, and made to work 2-3 jobs."
504,2022-05-19 22:56:26+00:00,How does Ukraine pay us back?
505,2022-05-19 22:38:37+00:00,"⚡️Egypt turns away shipment of grain Russia stole from Ukraine. 

Ukrainian Foreign Minister Dmytro Kuleba thanked Egypt on Twitter on May 19 for refusing a Russian ship the Ukrainian Embassy in Egypt alleged was transporting grain stolen from Ukraine."
506,2022-05-19 22:31:35+00:00,"⚡️Reuters: US wants to give Ukraine “advanced anti-ship missiles” to defeat Russia's naval blockade.

The White House is looking to arm Ukraine with Boeing Harpoon and Naval Strike missiles made by Kongsberg and Raytheon Technologies, Reuters reports, citing U.S. officials."
507,2022-05-19 22:18:37+00:00,"Excellent gesture, very patriotic of ⁦@BBhuttoZardari⁩ going an extra mile to defend Imran Khan’s extremely controversial timing to visit Moscow and meet Putin on the day when Russian troops invaded Ukraine, Imran Khan please reciprocate the young leader https://t.co/6OoIRHsMSv"
508,2022-05-19 22:08:52+00:00,Biden just added $100 million in arms for Ukraine and another 215 million dollars for food. Why doesn’t the $40 BILLION package cover arms and food? Why is there three separate packages?
509,2022-05-19 21:48:03+00:00,"Meanwhile on Russian state TV: Professor Alexei Fenenko, leading research fellow at the Institute of International Security Studies, says that for Russia, its war in Ukraine is a rehearsal for a potential larger conflict with NATO countries. https://t.co/OSelLyltc5"
510,2022-05-19 21:44:32+00:00,11 senators said no more money to Ukraine.  The other 89 need to be replaced.
511,2022-05-19 21:42:10+00:00,"NOT. ANOTHER. DIME. TO. UKRAINE! 

58 BILLION. IS. ENOUGH!"
512,2022-05-19 21:07:08+00:00,BREAKING NEWS: Experts announce that Russian Dictaor Vladimir Putin is losing his grip on power because his top military officials are realizing that his invasion of Ukraine is “lost” — making a coup to oust him from power now very likely. RT IF YOU THINK THAT THIS IS GREAT NEWS!
513,2022-05-19 20:20:16+00:00,Biden Unveils $100 Million More In Weapons To Ukraine Literally Moments After $40BN Approved https://t.co/nxyqoHxizg
514,2022-05-19 19:47:49+00:00,"Sen. John Kennedy (R-LA) on why he voted for the $40 billion Ukraine funding: Putin ""has Stalin's taste for blood,"" and is ""working with"" China and Iran to dominate the world. ""This is not just a fight for the people of Ukraine,"" it's a fight for ""the freedom of Louisiana"" https://t.co/NGuwymtlDR"
515,2022-05-19 19:41:12+00:00,"An Ex-KGB spy, Yuri Shvets, said Russia has been “grooming” Trump to be a Russian asset for 40+ years. Why is MSNBC covering the Debunked Hunter Biden scandal — instead of the fact that Trump was engaged in Espionage and Treason?"
516,2022-05-19 19:40:01+00:00,"BREAKING: Biden admin adds $100 million in arms for Ukraine on top of $40 billion aid package
https://t.co/KCZRxTf8xq"
517,2022-05-19 19:20:57+00:00,"Only 11 Senators courageous enough to stand up and say NO to a $40 Billion handout to Ukraine:

Marsha Blackburn
John Boozman
Mike Braun
Mike Crapo
Bill Hagerty
Josh Hawley
Mike Lee
Cynthia Lummis
Rand Paul
Roger Marshall
Tommy Tuberville

God bless them."
518,2022-05-19 19:19:39+00:00,I applaud Congress for passing the security package I requested and for sending a clear bipartisan message to the world that the U.S. stands with Ukraine. This package will allow us to send even more weapons and ammunition to Ukraine as they defend their democracy and freedom.
519,2022-05-19 19:12:27+00:00,"Russian senator Frants Klintsevich has an ingenious new excuse for his country's slow progress in Ukraine

He says Ukraine's army is ""one of the strongest and best-trained"" because it's comprised of ""Russian soldiers and officers with exactly our mentality""

(with subtitles) https://t.co/TgYqbLX5BW"
520,2022-05-19 18:46:12+00:00,"$40 BILLION to Ukraine is an America last failure.

Intelligence briefings with “reasons” why we have to go to war with Russia are similar to the intelligence community telling lies about weapons of mass destruction in Iraq.

The future of the Republican Party is America First."
521,2022-05-19 18:45:28+00:00,"Bernie Sanders just voted YES on funding the US proxy war in Ukraine to the tune of $40 billion. So now it's officially on the record that every national politician associated with the activist ""Left"" is completely on board with escalating the war. That's what the ""Left"" is now"
522,2022-05-19 18:25:53+00:00,"While you're struggling to pay for groceries and gas and can't find formula to feed your baby, the uniparty just voted to approve another $40 billion for Ukraine.

They hate your guts."
523,2022-05-19 18:10:59+00:00,"I have authorized $100 million in additional U.S. arms, equipment, and supplies for Ukraine to reinforce its defenses against Russia’s senseless war of choice. We stand #UnitedwithUkraine."
524,2022-05-19 18:04:26+00:00,"Today, the Senate passed more emergency military, economic, and humanitarian aid for Ukraine at President Biden’s request.

Now more help is on the way as we continue to stand with the Ukrainian people."
525,2022-05-19 18:03:40+00:00,"$28 million to address the baby formula shortage.

$40 billion to Ukraine.

Mitch McConnell, RINOs, and Democrats don’t care about you."
526,2022-05-19 18:02:02+00:00,"The Republicans and Democrats in Congress just voted to send Ukraine $40 billion dollars, in addition to the 18 billion they've already sent them - all while Americans are broke and suffering.

Every single person who voted for this HATES YOU. Never trust another word they say."
527,2022-05-19 17:55:39+00:00,"BIDEN: TO PROVIDE NEW SECURITY ASSISTANCE PACKAGE TO UKRAINE

Wait, more?"
528,2022-05-19 17:48:59+00:00,"I praise the 🇺🇸 Senate's approval of the Additional Ukraine Supplemental Appropriations Act of 2022. $ 40 billion is a significant 🇺🇸 contribution to the restoration of peace and security in Ukraine, Europe and the world. We look forward to the signing of the law by @POTUS"
529,2022-05-19 17:32:35+00:00,"Senate Republicans who voted to send 40,000,000,000 US taxpayer dollars to Ukraine:  

Ted Cruz
Lindsey Graham 
Marco Rubio 
Mitch McConnell 
Tom Cotton 
Tim Scott 
Ben Sasse 
Mitt Romney 
Rick Scott"
530,2022-05-19 17:26:37+00:00,"Beyond disgusting that CPAC’s Matt Schlapp, in Budapest, calls his fellow authoritarian grifters “freedom fighters"" while real freedom fighters are fighting and dying in Ukraine.  https://t.co/2h3KXiYAxl"
531,2022-05-19 17:18:04+00:00,"BREAKING: The Senate has voted 86-11 in favor of the money laundering scheme to Ukraine.

11 Republicans who voted against:

Hawley (MO), Marshall (KS), Crapo (ID), Braun (IN), Paul (KY), Blackburn (TN), Hagerty (TN), Lummis (WY), Boozman (AK), Tuberville (AL), Lee (UT)."
