,Date,tweet
1202,2022-05-09 14:57:44+00:00,"Lindsey Graham declares, ""let's take out Putin"" and says there is ""no off-ramp in this war"" -- also continues to suggest a No Fly Zone. ""We can win this war on behalf of Ukraine,"" he adds. No compunction whatsoever about announcing that the goal is US-imposed regime change https://t.co/xNY3aejddE"
1203,2022-05-09 14:51:24+00:00,"While the Greek community suffers in #Mariupol from russian bombs, #Greece continues business as usual with #Russia. Greek government protests ban on shipping  Russian oil, clearly weakening the 6th #EU sanction package. Really, Greece?"
1204,2022-05-09 14:27:25+00:00,"⚡️ Russia increases number of missile carriers in Black Sea.

As of May 9, Russia has 7 carriers of Kalibr missiles in the Black Sea that can fire up to 50 missiles, Defense Ministry said. On May 4, Ukraine’s military reported 3 Russian missile carriers in the Black Sea."
1205,2022-05-09 14:02:44+00:00,"I have never been more certain that Ukraine will win.

Britain will stand shoulder-to-shoulder with Ukraine for as long as it takes.

Slava Ukraini 🇺🇦 https://t.co/0e3UpIy9O5"
1206,2022-05-09 14:00:29+00:00,"Protesters chanting “fascists” threw red liquid at Russia’s ambassador to Poland as diplomats visited a Warsaw memorial honoring Red Army soldiers killed in World War II.
https://t.co/fk5m48WAUH https://t.co/ocFEMDajhU"
1207,2022-05-09 13:36:29+00:00,Update: The Canadian flag is once again flying over Canada’s embassy in Kyiv. We raised it yesterday to symbolize the formal return of Canada’s diplomatic presence in Ukraine. https://t.co/BGVbiA7CQg https://t.co/3GiMrpQyWd
1208,2022-05-09 13:32:28+00:00,Justin Trudeau attempted to raise the Canadian flag at our embassy in Ukraine and managed to embarrass our country again. https://t.co/RoHCfRGfG7
1209,2022-05-09 13:31:00+00:00,"Ukraine has lost. It can't defeat Russia. They can't contain or break up or weaken Russia without destroying the world economy. The $33 billion is a cash cow for defense contractors to continue a forever war. Phony concern for ""disinformation"" is to shut you up about all this."
1210,2022-05-09 13:22:36+00:00,"Two days ago Joe had sent another $150 Million of our tax-payer money to ukraine! 
Today he’s telling Congress to “swiftly approve” more than $33 Billion! 

This is CRAZY!! It never ends!"
1211,2022-05-09 13:14:22+00:00,"First Minister @NicolaSturgeon will visit the USA next week to underline Scotland’s key interests in global issues including the climate emergency and war in Ukraine, as a new framework for @ScotGov work to become more active internationally is published.

https://t.co/L2htADFVX3 https://t.co/5M7cL7O04j"
1212,2022-05-09 13:05:05+00:00,Protesters opposed to the war in Ukraine threw red paint on Russia’s ambassador to Poland Sergey Andreev as he arrived at a cemetery in Warsaw to pay respects to Red Army soldiers who died during World War II. https://t.co/S2SMcPPvVx https://t.co/8hgQutHGRK
1213,2022-05-09 13:03:36+00:00,"Joe Biden isn’t physically up to travel to Ukraine. So he sent his wife. 

The DC propagandists are once again covering up Joe’s failures."
1214,2022-05-09 13:01:05+00:00,our PM on the right https://t.co/ZTdhmGYULI
1215,2022-05-09 12:34:06+00:00,"⚡️#Zakharova: Russian Ambassador to #Poland Sergey Andreyev &amp; Russian diplomats accompanying him were assaulted in #Warsaw at the cemetery of Soviet soldiers. 

Neo-Nazi fans showed their face once again – and it is a bloody one.

🔗 https://t.co/WB5j7YvS3t https://t.co/MZs1xK0jaE"
1216,2022-05-09 12:29:02+00:00,"I am returning home to the United States carrying with me the stories of the mothers and children I met. 

As a Romanian mother said: ""our hearts have no borders."" 💕

We are committed to supporting Ukraine, the Ukrainian people, and our Allies and partners."
1217,2022-05-09 12:20:04+00:00,"Zelensky stakes Ukraine’s own claim to Soviet victory day, with a characteristically powerful and well delivered speech. Reclaiming May 9 instead of viewing it as irrevocably contaminated. Quite bold https://t.co/xjaR2y9K0F"
1218,2022-05-09 11:50:59+00:00,"💬 President Putin: May 9, 1945 has been enshrined in world history forever as a triumph of the united Soviet people. 

❗️ It is our duty to preserve the memory of those who defeated Nazism &amp; entrusted us with doing everything to thwart the horror of another global war. https://t.co/lt6N1aXRsB"
1219,2022-05-09 11:29:57+00:00,"BREAKING: @JustinTrudeau risks life and limb by traveling to #Ukraine and walking around outdoors without the protection of an N95 facemask.

👇🏻 https://t.co/t3RRCdnKNP"
1220,2022-05-09 11:26:54+00:00,"It's Monday - has Joe Biden sent another gazillion dollars to Ukraine yet? 

NO. MORE. TAX. DOLLARS. TO. UKRAINE.

WE'RE. BROKE."
1221,2022-05-09 11:13:54+00:00,"There he sat, a sad spectacle, with no new victories to report, during this twisted misappropriation of Russia's #VictoryDay. https://t.co/WMZ6jZJlcz"
1222,2022-05-09 10:42:25+00:00,"I wonder what my great grandfather, an IS-2 tank driver during WWII, would say if he could see what Russia is doing now."
1223,2022-05-09 10:39:02+00:00,"This is our brave Belarusian defender in #Ukraine. In the battle of Bucha, he was wounded in the leg resulting in its loss. Now he has recovered and is back on the frontline.

#Belarus https://t.co/UPAH2GrpU4"
1224,2022-05-09 10:37:42+00:00,With fewer soldiers and tanks - and a cancelled air force display - Russia’s Victory Day parade inadvertently shows off country’s shrunken power. My report  https://t.co/Hm0tnZWjQW https://t.co/IG7SQps2K6
1225,2022-05-09 10:29:46+00:00,"I would invite everyone to set politics aside for a moment and to reflect on the important this scene to the people of Ukraine, who look to us for support and inspiration. Everywhere I have gone here - the moment you say you are Canadian - you’re treated like an old friend. https://t.co/m0xQc19lYs"
1226,2022-05-09 10:13:48+00:00,"While russia parades on Red Square, thousands of its dead soldiers are stacked in bags in refrigerator trains 🇺🇦, @AJEnglish reports. russians refuse to take them, so #Ukraine might even have to bury them at our own cost. #RussianWarCrimes #Kyiv https://t.co/rbVrZuI8de"
1227,2022-05-09 09:22:08+00:00,"Last night on a German TV talk show, a German sociologist with no knowledge of Ukraine or Russia whatsoever aggressively lectured the Ukrainian ambassador about the war in his country, basically arguing that Germans have a superior knowledge about wars because of their history"
1228,2022-05-09 09:08:21+00:00,Hungary now blocks all further EU sanctions on Ukraine. Remind me why they are in NATO?
1229,2022-05-09 09:04:18+00:00,"🇷🇺Russia holds #VictoryDay Parade on Moscow’s Red Square.

President #Putin: We will never give up our love for the country, faith, traditional values, ancestral customs and respect for all peoples and cultures.

#9May #Russia #VictoryParade #VictoryDay2022 #WeRemember https://t.co/9cElPIuL8G"
1230,2022-05-09 08:31:14+00:00,"Sunflowers grown in ZA. 
Sunflower oil manufactured in ZA.
But the price tripled because ""war in Ukraine"".
What am I missing?"
1231,2022-05-09 08:25:38+00:00,"⚡️ Putin continues to spread lies defending war, shows no signs of backing down. 

Speaking at Russia’s annual Victory Day parade in Moscow, Putin said the invasion of Ukraine was necessary “as the West was creating threats next to our borders.”"
1232,2022-05-09 08:12:30+00:00,"Colonel Ihor Bedzai, the Ukraine Navy’s deputy commander for aviation.
Killed in air combat. https://t.co/xmc1P3FomZ"
1233,2022-05-09 08:02:20+00:00,victory parody https://t.co/6vM0hEWTp3
1234,2022-05-09 07:54:57+00:00,"trudeau wears  a mask in Canada with a 90% vaxx rate for show, but not in Ukraine with 35% vaxx. SCIENCE!! https://t.co/7cZN2xgqng"
1235,2022-05-09 07:48:57+00:00,"⚡️Zelensky in his WWII victory day speech: 'We won then. We will win now.'

“We will never forget what our ancestors did in World War II, which killed more than eight million Ukrainians,” said President Zelensky. 

“Very soon, there will be two Victory Days in Ukraine,” he added. https://t.co/4nDmY7bDPS"
1236,2022-05-09 07:48:48+00:00,So Justin Trudeau took Mélanie Joly and Chrystia Freeland to see U2 in Ukraine on Mother’s Day amidst a raging war? Am I getting this right?
1237,2022-05-09 07:34:31+00:00,11K soldiers in parade in #Moscow. 25.6 K #Russia soldiers lie dead in #Ukraine soil. That’s 25 650 to be exact. Twice as much as on that parade of shame https://t.co/kTeYkk3we0
1238,2022-05-09 07:33:07+00:00,"A minute into his speech, Putin starts spreading conspiracy theories about NATO planning to attack Russia with the help of “Ukrainian Nazis”.

This man needs to leave the stage of world politics. https://t.co/yZbqhKcrDA"
1239,2022-05-09 07:18:32+00:00,"Less than a minute into his speech, Putin turns to conspiracy theories about NATO plotting to attack Russia through Ukraine nazis. https://t.co/imb1EQAsuA"
1240,2022-05-09 06:53:42+00:00,"So if it's so dangerous in Ukraine that Ukrainians are fleeing for their lives, why are celebrities, world leaders etc visiting all of a sudden??? Seems a bit strange. 🤔"
1241,2022-05-09 06:49:14+00:00,"We have a new Bingo competition.

Who is going to pop up in UKraine next?

I’m going……. Lady Gaga"
1242,2022-05-09 06:30:45+00:00,"President of #Ukraine @ZelenskyyUa: “We won then. We will win now, too! And Khreshchatyk will see the parade of victory – the victory of Ukraine. Glory to Ukraine!” https://t.co/339L7s6Faz"
1243,2022-05-09 05:34:09+00:00,BREAKING: Russia's last remaining tank takes part in Victory Day parade https://t.co/8cA9B1EjUF
1244,2022-05-09 05:10:46+00:00,"Fk me, Angelina Jolie, Boris Johnson, Nancy Pelosi, Boris Johnson, Jill Biden and now Justin Trudeau. Anyone else wanna go to Ukraine, it seems to be the 'in' holiday destination atm 😳😳🤣🤣🤣🤣🤣🤣"
1245,2022-05-09 04:32:56+00:00,"On Victory Day, Putin is losing his war in Ukraine. Time for Russian soldiers to go home."
1246,2022-05-09 04:05:06+00:00,Trudeau could visit Ukraine in the middle of a war for a photo op with Zelensky but he was too afraid to speak to the Freedom Convoy truckers.
1247,2022-05-09 03:59:34+00:00,"⚡️Ukraine’s military: Russia deploys 6 ships, 2 submarines near Ukraine in Black Sea. 

Ukraine’s Operational Command South reported on May 8 that the ships are combat-ready and equipped with over 50 cruise missiles."
1248,2022-05-09 03:08:41+00:00,"The blockade of the Port of #Odessa could create worldwide starvation.  The blockade should be broken either diplomatically, or militarily if necessary.  #ukraine"
1249,2022-05-09 01:40:07+00:00,"Patron, an expert bomb finder and perhaps Ukraine's smallest fighter, has been honored by the country's president. 

He has found more than 200 Russian explosives, President Volodymyr Zelenksy said, and also helps children learn about mine safety. https://t.co/dmJ37qU0tf https://t.co/yn3xH0dV6Q"
1250,2022-05-09 01:05:37+00:00,"How embarrassing. Half of Trudeau's cabinet is standing around trying to figure out how to raise the flag at the Canadian embassy in Ukraine. Naturally, Trudeau and Co. are too stupid to figure it out. 

https://t.co/cH6KCUBD02"
1251,2022-05-09 00:21:14+00:00,"Peace, justice, and freedom prevailed when the Second World War came to an end. 77 years later, we must once again defend these values and push back against violent aggression – for Ukraine, for Europe, and for the world. #VEDay"
1252,2022-05-08 23:27:11+00:00,"Today, Putin stated:

“Our soldiers, as their ancestors, are fighting side by side to liberate their native land from the Nazi filth with the confidence that, as in 1945, victory will be ours.”

He then wished “all of Ukraine's inhabitants a peaceful and just future.”

Pure evil. https://t.co/5zfOLU6DXy"
1253,2022-05-08 23:02:55+00:00,"Canada’s support for Ukraine remains steadfast. I reiterated that during today’s meeting with G7 leaders, which President @ZelenskyyUa and I joined together from Kyiv. We spoke about the current situation and our coordinated response."
1254,2022-05-08 22:13:48+00:00,"Wear a mask even when outdoors in Canada in one of the most vaccinated places on earth, but in Ukraine, one of the least vaccinated places on the planet, go maskless in a room full of people. Makes total sense.🙄 https://t.co/BivjtwigoW"
1255,2022-05-08 22:03:32+00:00,"Ukraine must be one hell of a warzone if you can have U2 concerts there... with full production and press coverage.
 https://t.co/4q70GktaPs"
1256,2022-05-08 21:59:03+00:00,"⚡️ Ukraine’s military defeats 190 Russian troops, 15 tanks in eastern Ukraine on May 8."
1257,2022-05-08 21:49:09+00:00,"I am proud that the Prime Minister flew to Kyiv to raise the Canadian flag at the embassy in Ukraine. 
I don't often agree with him on issus but as the elected head of our nation he does us proud standing in solidarity with the Ukrainian people.
Bravo.
https://t.co/TjZEtEskBf"
1258,2022-05-08 21:26:50+00:00,"Earlier today, @CAFreeland, @MelanieJoly, and I arrived in Ukraine. We met with President @ZelenskyyUa and visited Irpin. We saw the destruction caused by Putin, but we also saw the strength &amp; courage of Ukrainians – and as they continue to fight, we’ll continue to support them."
1259,2022-05-08 21:03:55+00:00,"Today is #VictoryDay in Russia &amp; beyond!

It marks the 77th Anniversary of the Victory against the greatest evil - Nazism.

Not a single family was left untouched by Nazi atrocities. 

🕯️ #OTD we pay tribute to the Soviet heroes who ensured peace for all humankind! #LestWeForget https://t.co/uFuS7sa41q"
1260,2022-05-08 21:03:25+00:00,"On this day in 1945, the Nazis surrendered.

And now, 77 years later, another dictator is trying to subjugate the people of a neighboring country.

But there will be no victory for Russia.

Ukraine, and peace, will prevail.

And democracy will again triumph over dictatorship."
1261,2022-05-08 21:01:00+00:00,"🌟 Happy #VictoryDay! 

Today marks the 77th Anniversary of the Great Victory over Nazism. 

#LestWeForget

#Victory77 #VDay77 #May9 #WeWereAllies https://t.co/GR9CfjPQ02"
1262,2022-05-08 20:49:27+00:00,"#Ukraine Even in the darkest times, music gives strength to Ukrainian defenders, raises morale and mobilises. This is the violinist Moisei Bondarenko, a soldier of the Armed Forces of Ukraine. https://t.co/RJ1a6eOXHD"
1263,2022-05-08 20:43:38+00:00,"🇷🇺 This evening men of all ages across Russia started to receive general mobilization notices from their local military command. 

See below. https://t.co/kUbSsGX68j"
1264,2022-05-08 20:37:24+00:00,Justin Trudeau and Bono are also in Ukraine today. The most ominous sign yet
1265,2022-05-08 20:29:30+00:00,"Canada stands shoulder to shoulder with Ukraine. Today in Kyiv, Prime Minister @JustinTrudeau announced additional Canadian military aid for Ukraine. 

We will supply this equipment as quickly as possible so that Ukraine can fight and win this war. 🇨🇦🇺🇦 https://t.co/HB3qwbMO8X"
1266,2022-05-08 20:18:59+00:00,Now celebrities are visiting Ukraine… Don’t they know it’s a war zone? LOL!!!
1267,2022-05-08 20:08:00+00:00,"IF the war in Ukraine was terrifyingly bad...as advertised. WHY would our PM, Deputy PM, AND minister of foreign affairs make a surprise visit to the country? 🤔🤔🤔🤔 some fuckery afoot"
1268,2022-05-08 20:05:23+00:00,Justin Castro tried to raise the flag at the Canadian Embassy in Ukraine but Karma said f**k that! https://t.co/mrPOHZB7yZ
1269,2022-05-08 19:58:58+00:00,Hang on all…Ukraine has been saved. Bono has turned up to sing in a tunnel. Have you ever seen such a cringe fest. 👀🤮😂🤣 https://t.co/iCm8RkWLl8
1270,2022-05-08 19:35:27+00:00,"This afternoon I spoke to G7 and European leaders, as well as @ZelenskyyUa.

We agreed to intensify our economic and military support for Ukraine. 

We also agreed more must be done to underpin food security and ensure agricultural exports can leave the country. https://t.co/sIknJgHskM"
1271,2022-05-08 19:32:35+00:00,"It was utterly wrong for Johnson to pledge another £1,300,000,000 in weapons to escalate war in Ukraine on the eve of VE Day."
1272,2022-05-08 19:12:52+00:00,"Boris Johnson is breaking into the UK Emergency fund, not for the UK but to give another £1.5 billion to Ukraine. What the hell does he think he's doing?"
1273,2022-05-08 18:55:00+00:00,"Russia's forces have committed war crimes in Ukraine, killed thousands of civilians, and created a humanitarian catastrophe. In response, the @StateDept has imposed visa restrictions on over 2,600 Russian and Belarusian military and other officials to promote accountability."
1274,2022-05-08 18:46:41+00:00,"@vosboks @BorisJohnson Kept Labour out of number 10 got Brexit done ,guided us through COVID ,and has been a leader on the world stage particularly on Ukraine, all while working through the great Tory manifesto,step by step ,Best PM since  Maggie  ."
1275,2022-05-08 18:39:37+00:00,"Question?  Why is Joly in the Ukraine with Freeland and Trudeau?
Did she not just return from a trip to Europe?"
1276,2022-05-08 18:22:16+00:00,What is the real reason all these world leaders are flocking to Ukraine in person? Truly bizarre.
1277,2022-05-08 18:19:03+00:00,"Joes wife is not an elected official, so why did she “sneak into Ukraine,” on OUR dime? 

Just a photo-op in Poland..."
1278,2022-05-08 18:07:41+00:00,"John Parker, a communist party candidate for U.S. President in 2004 (he got 1,330 votes), showed up in occupied Rubizhne, Luhansk region to give support to Russian imperialists invading Ukraine.

This image is all over Ukrainian social media, with appropriate ridicule. https://t.co/aAVPon1dOP"
1279,2022-05-08 17:49:22+00:00,Our brave and beautiful First Lady crossed the border into Ukraine! Would Melania have done this?
1280,2022-05-08 17:39:56+00:00,"BREAKING: after seeing the publicity FLOTUS and Justin Trudeau generated for their surprise visit to the Ukraine, Donald Trump tries to do the same - but winds up instead at the U-Crane rental facility in Toledo, Ohio. https://t.co/bQM1m9aGrm"
1281,2022-05-08 17:38:33+00:00,The jig is up. The United States government would not allow the First Lady to step foot in a country that is being invaded. It’s too dangerous. All of you with the Ukraine flag in your bios can take them off.
1282,2022-05-08 17:34:51+00:00,"In a last ditch effort to drive Russian troops out of Ukraine, Zelensky resorts to inviting U2 to ‘perform,’ possibly the most heinous act committed in the conflict to date. 
https://t.co/g6RY4yJSse"
1283,2022-05-08 17:30:32+00:00,"Today, I spoke with G7 Leaders and President Zelenskyy about our ironclad unity and commitment to keep strengthening Ukraine and ratcheting up the pain on Putin. https://t.co/15FYYnfueS"
1284,2022-05-08 17:11:30+00:00,I see all the politicians went to the Ukraine to get their laundered money.
1285,2022-05-08 16:52:35+00:00,Why is Jill Biden in the Ukraine? Inquiring minds want to know. 🤔
1286,2022-05-08 16:48:04+00:00,Why is Jill Biden in Ukraine?
1287,2022-05-08 16:33:13+00:00,"Why are world elites and sleazy politicians going to Ukraine in the middle of a war? 

Am I missing something? Is this normal? Shouldn’t it be too dangerous?"
1288,2022-05-08 16:26:54+00:00,"Today we #G7 discussed with @ZelenskyyUa how to strengthen our support to Ukraine in the face of the Russian invasion. 

From further financial assistance to keep the economy running &amp; measures to help Ukraine exports, esp. agricultural goods: 

@EU_Commission stands by Ukraine. https://t.co/edGm5fVf92"
1289,2022-05-08 16:04:28+00:00,"Excellent. Very important show of support. Good for him.

Trudeau makes surprise visit to Kyiv as Russia readies ‘Victory Day’ show - National | https://t.co/ISpfvF5GrX https://t.co/BMqJLRnlsP"
1290,2022-05-08 15:44:16+00:00,I’m in Ukraine with @cafreeland and @melaniejoly today. We’re here to show our support for Ukraine and its people. Our message to President @ZelenskyyUa and Ukrainians is this: Canada will always stand shoulder to shoulder with Ukraine. More to come on our visit.
1291,2022-05-08 15:28:35+00:00,Why the fuck would Jill Biden need to go to Ukraine…?
1292,2022-05-08 15:12:48+00:00,"Alexander Dugin, so called “Putin’s brain” announces Russia’s geopolitical agenda for the Balkans. The last 30 seconds are telling and chilling.
https://t.co/5mrObyZXWM"
1293,2022-05-08 15:10:07+00:00,"BREAKING: Jill Biden makes surprise visit to Ukraine… 

It’s ALL Propaganda"
1294,2022-05-08 15:00:43+00:00,Volunteers in Ukraine have placed these pet food feeding stations up all over destroyed neighborhoods so that the cats and dogs left behind won't starve to death. https://t.co/BJQupUo8Ru
1295,2022-05-08 14:58:45+00:00,Why is the Republican party content to be a wholly-owned subsidiary of Russia? Is it really as simple and sad as the money? https://t.co/zFU0UAf7I1
1296,2022-05-08 14:56:02+00:00,"Of course U2 have arrived in Ukraine, I would expect nothing less. https://t.co/44K8HzN9zp"
1297,2022-05-08 14:55:14+00:00,"#Breaking: Prime Minister Justin Trudeau visits Ukraine, becoming the latest world leader to touch down in the country in support of its fight against Russia's invasion. https://t.co/Ak5OtrGqyt"
1298,2022-05-08 14:51:38+00:00,"On this Mother’s Day, my heart is with you, First Lady Olena Zelenska, and all of the brave and resilient mothers of Ukraine. https://t.co/tCMXCXhgiY"
1299,2022-05-08 14:35:04+00:00,"Following a personal invitation from Ukraine president Volodymyr Zelensky, U2’s Bono and the Edge visited Kyiv Sunday to perform an acoustic concert in one of the city’s subway stations-turned-bomb shelters https://t.co/ZT7lvH0X6F"
1300,2022-05-08 14:28:25+00:00,"As UK taxpayers strain to keep up with Johnsons unrelenting spaffing of cash he's now pledged an extra £1.3bn in military support to Ukraine, on top of his existing £1.5bn support to Kyiv.

Who's he working for....? https://t.co/H7Z7vS1x1E"
1301,2022-05-08 14:23:49+00:00,BREAKING: @JustinTrudeau @melaniejoly and @cafreeland have made a surprise visit to #ukraine right now. #cdnpoli
1302,2022-05-08 14:18:25+00:00,"Here's neocon family dynast Fred Kagan explaining to Bill Kristol why the US must reject negotiations and ensure the total military ""defeat"" of Russia. This could've been uttered by any Dem or GOP today. Kagan's neocon views are now 100% mainstream across the political spectrum https://t.co/2nCcmx7OT9"
1303,2022-05-08 14:15:57+00:00,What in the Hitlers Youth is going on in Putin’s Russia?  https://t.co/n1cItImUfA
1304,2022-05-08 14:06:24+00:00,"Jill Biden visited with the First Lady of Ukraine bearing flowers in an act of solidarity &amp; support.

Melania Trump visited the kids in cages at the southern border wearing an “I really don’t care do u” jacket in an act of selfishness &amp; spite.

See the difference?"
1305,2022-05-08 14:06:23+00:00,"BREAKING: In an unexpected interview, a Mariupol resident told the BBC that it was Azov troops who were refusing to let them leave the Azovstal Steel Plant, as opposed to Russia."
1306,2022-05-08 14:04:32+00:00,FM #Lavrov: Ukrainian people do not need Stingers and Javelins. What they need is a solution to urgent #humanitarian issues. #Russia has been doing this since 2014. https://t.co/MD5OJFGZiz
1307,2022-05-08 14:02:05+00:00,There is nothing more like @FLOTUS than spending her Mother's Day standing up for the mothers of Ukraine. https://t.co/7jhz8xbT77
1308,2022-05-08 14:01:20+00:00,"NEW: Jill Biden made an unannounced visit into Ukraine on Mother’s Day to meet with Ukrainian first lady Olena Zelenska. 

 Her surprise visit came after she met with refugees and volunteers at the Slovakia border. https://t.co/3mTvTnShyi https://t.co/idhDFRsxbN"
1309,2022-05-08 13:58:34+00:00,"WOW! First Lady Dr. Jill Biden just made a surprise trip to Western Ukraine! Here she is with the First Lady of Ukraine, Olena Zelenska. https://t.co/odiTIQAEvb"
1310,2022-05-08 13:37:06+00:00,"Oh...Jill Biden is visiting Ukraine.

Problem Solved."
1311,2022-05-08 13:29:19+00:00,"NEWS: surprise visit by @FLOTUS to Ukraine and a surprise appearance by Ukrainian first lady Olena Zelenska, who has been in hiding since the start of the Russian invasion https://t.co/wrHAyEb57x"
1312,2022-05-08 13:26:13+00:00,"BREAKING: First lady Jill Biden crossed the border into Ukraine, making an unannounced visit to the country amid Russia’s ongoing invasion. She met with Ukrainian first lady Olena Zelenska, who had not appeared in public since the Feb. 24 Russian invasion. https://t.co/vTgDSilA8Z"
1313,2022-05-08 13:25:38+00:00,"The moment First Ladies Jill Biden 🇺🇸 and Olena Zelenska 🇺🇦met today in Uzhhorod, Ukraine https://t.co/9UsdBBA6Eh"
1314,2022-05-08 13:01:36+00:00,War in Ukraine: Zelensky WW2 speech accuses Russia of Nazi atrocities https://t.co/ROwxiqGLGW
1315,2022-05-08 12:49:07+00:00,"It's critical that someday, soon, the story of Russia's deep penetration of the Republican Party be written.

We need to understand how a hostile foreign power got so deep into one of our parties, and ensure it never happens again.

Read this thread from @SteveSchmidtSES. 2008. https://t.co/5b8WF64ZDA"
1316,2022-05-08 12:26:07+00:00,"Horrified by Russia's latest attack on a school in Luhansk, resulting in the deaths of innocent people sheltering from Russian bombardment. Deliberate targeting of civilians &amp; civilian infrastructure amounts to war crimes. We will ensure Putin’s regime is held accountable."
